Disease,Symptoms,Medical_Specialty
impetigo,"an_infection, a_burning_sensation, small_sores, bullous_impetigo________________bullous_impetigo_________bullous_impetigo___bullous_impetigo_bullous_impetigo, lips, bullous_impetigo, a_few_days, yellow_stuff, the_trunk, itching, my_nose, small_red_sores, flu-like_symptoms, high_fever, the_main_symptom, the_rash, chest, ooze, my_face, i, patient, some_yellow_fluid, touch, a_fever, a_yellow_or_rust-colored_discharge, my_face_and_nose_area, a_sore, ecthyma________________ecthyma_________ecthyma, system:'you, painful_fluid-_or_pus-filled_sores, my_body, patients, a_headache, a_high_fever, mouth, children, and_a_rash, blister, the_skin, bullous_impetigo___bullous_impetigo_bullous_impetigo, other_areas, headache, a_rash, a_yellow_colored_fluid, which, skin_rash, towels, young_children, it, ecthyma____________ecthyma, close__close_ecthyma___ecthyma, fluid-filled_blisters, my_arms, a_more_serious_form, deep_ulcers, rashes, a_yellow-rust_colored_liquid, arms, and_arms, the_touch, that, a_honey-colored_crust, larger_blisters, close__close_bullous_impetigo___bullous_impetigo_bullous_impetigo, the_condition, a_yellow_ooze, chills, my_cheek, body_pain, bullous_impetigo____________bullous_impetigo___bullous_impetigo_bullous_impetigo, red_sores, the_red_sores, recent_days, legs, my_health, my_cheeks, clear_fluid, younger_than_2_years, the_blisters, neck, some_medications, face, other_parts, what, a_yellow-rust_colored_fluid, impetigo, a_high_temperature, a_yellow_fluid, some_yellow_sores, redness, yellow_fluid, fluid, fever, oozing_yellow_fluid, penetrates, medication, the_body, sores, the_nose, yellow_liquid, little_sores, little_blisters, them, a_burning_feeling, my_neck, yellow_crust_ooze, a_yellow_or_rust-colored_fluid, blisters, clear_pus, ecthyma, a_serious_form, a_less_common_form, soreness, bullous_impetigo_bullous_impetigo, reddish_sores, the_sores, infants, nose, clothing, this, my_skin, me, they, a_long_time","Dermatologist, Otolaryngologist"
impulse control disorder,"urges, difficulty, impulsive_behaviors",Psychiatrist
incompetent cervix,"pregnancy, the_course, system:'you, patients, symptoms, 14_and_20_weeks, early_pregnancy, mild_discomfort, an_incompetent_cervix, any_signs, a_change, you, several_days, pelvic_pressure, vaginal_discharge, a_sensation, the_lookout, i, weeks, patient, some_women","Gynecologist, Otolaryngologist"
indigestion,"fullness, that, system:'you, nausea, patients, people, a_meal, your_upper_abdomen, less_frequent_signs, symptoms, your_breastbone, the_area, the_feeling, your_chest, your_neck, heartburn, abdominal_pain, an_uncomfortable_sensation, uncomfortable_fullness, your_meal, the_bottom, it, you, a_mild_to_severe_pain, early_fullness, a_pain_or_burning_feeling, tightness, the_center, indigestion, the_upper_abdomen, i, acidic_taste, patient, an_uncomfortable_heat_or_burning_sensation, your_bellybutton","Gastroenterologist, Orthopedist"
induced abortion,"vaginal_bleeding, nausea, cramping, abdominal_pain, emotional_distress, fatigue",General Practitioner
infant acid reflux,"most_cases, the_throat, it, system:'you, i, patients, infant_reflux, stomach_contents, enough_acid, patient, concern, symptoms, a_cause","Gastroenterologist, Otolaryngologist"
infant jaundice,"good_lighting_conditions, jaundice, system:'you, patients, yellowing, the_skin, your_baby, the_eyes, infant_jaundice, a_moment, natural_daylight, the_skin_color, the_second_and_fourth_day, the_main_sign, the_whites, it, you, mild_jaundice, nose, its_normal_color, i, your_baby's_forehead, birth, patient","Dermatologist, Otolaryngologist"
infection of open wound,"the_wound, pus, pain, drainage, redness, the_wound_site, warmth, malaise, tenderness, fever",Infectious Disease Specialist
infectious diseases,"its_own_specific_signs, system:'you, i, infectious_diseases, patients, general_signs, symptoms, fever_diarrhea_fatigue_muscle, patient, each_infectious_disease, a_number","Infectious Disease Specialist, Orthopedist"
infertility,"the_main_symptom, hair_growth, infertility, men, irregular_or_absent_menstrual_periods, system:'you, i, some_cases, patients, most_couples, no_other_obvious_symptoms, women, some_signs, patient, sexual_function, treatment, changes, hormonal_problems",Gynecologist
inflammatory bowel disease,"that, remission, signs, system:'you, inflammatory_bowel_disease_symptoms, patients, diarrhea_fatigue_abdominal_pain, symptoms, periods, your_stool, both_crohn's_disease, cramping_blood, it, you, unintended_weight_loss, active_illness, i, the_severity, patient, ulcerative_colitis, inflammation",Gastroenterologist
inflammatory breast cancer,"the_collarbone_flattening, signs, less_than_six_months, the_course, system:'you, the_nipple, patients, pain, symptoms, one_breast_discoloration, the_appearance, ridges, the_skin, the_arm, these_symptoms, thickness, visible_enlargement, several_weeks, other_forms, rapid_change, the_breast, purple, heaviness, the_affected_breast, an_orange_peel_tenderness, breast_cancer, enlarged_lymph_nodes, i, a_lump, one_breast, inflammatory_breast_cancer, pink_or_bruised_appearance_unusual_warmth, patient, the_collarbone",Oncologist
influenza (flu),"body, cough, high_fever, sore_throat, congestion, fatigue","Infectious Disease Specialist, Otolaryngologist"
ingrown hair,"ingrown_hair, that, signs, tweeze, system:'you, the_shape, patients, symptoms, the_skin, hyperpigmentation, blisters, the_hair_curves, itching_hair, you, pus_small_bumps, a_loop, the_tip, skin, small_bumps, i, patient, swollen_bumps",Dermatologist
ingrown toenails,"swelling_infection, system:'you, i, ingrown_toenail_symptoms, patients, pain, patient, tenderness",Infectious Disease Specialist
inguinal hernia,"that, signs, a_hernia_bulge, your_pubic_bone, system:'you, pressure, nausea, patients, pain, the_abdominal_wall, either_side, children, symptoms, a_long_period, the_tissue, the_hernia, the_area, the_protruding_intestine, a_bowel_movement, she, a_heavy_or_dragging_sensation, trouble, which, a_bulge, sudden_pain, a_strangulated_hernia, the_blood_flow, your_bowels, gas, it, the_scrotum__signs, you, the_testicles, an_older_child, an_incarcerated_hernia, your_groin_weakness, newborns, the_bulge_pain, a_burning, your_groin, sensation, he, purple_or_dark_inability, a_hernia, a_weakness, i, birth, the_contents, an_infant, patient, discomfort, children_inguinal_hernias, inguinal_hernia_signs","Gastroenterologist, Orthopedist"
injury to internal organ,"abdominal_pain, organ_dysfunction",General Practitioner
injury to the finger,"the_finger, pain, motion, restricted_range, difficulty, deformity",General Practitioner
injury to the leg,"difficulty, pain",General Practitioner
insect bites,itchy_bumps,General Practitioner
insomnia,"system:'you, attention, patients, a_doctor, sleepiness_irritability, the_night, a_sleep_center, anxiety_difficulty, the_day, night, tasks, insomnia_symptoms, insomnia, increased_errors, a_night's_sleep_daytime_tiredness, ongoing_worries, it, you, special_testing, your_sleep_problem, difficulty, accidents, depression, i, your_doctor, sleep, patient, a_sleep_disorder, the_cause",Psychiatrist
insulin overdose,"low_blood_sugar_(hypoglycemia)_symptoms, confusion, sweating",Endocrinologist
intermittent explosive disorder,"months, consequences, physical_fights_property_damage, system:'you, the_episode, patients, people, slapping, animals, relief, no_thought, explosive_eruptions, episodes, little_or_no_warning, physical_aggression, tremors_palpitations_chest_tightness, these_episodes, the_situation, embarrassment, the_time, temper_tantrums, you, proportion, regret, heated_arguments, tiredness, nonaggression, aggressive_episodes, rage_irritability, less_severe_verbal_outbursts, remorse, i, weeks, the_explosive_verbal_and_behavioral_outbursts, patient, a_sense",Psychiatrist
interstitial cystitis,"common_triggers, a_person, (up_to_60_times_a_day)_pain, the_vagina, signs, system:'you, no_infection, patients, pain, (perineum, symptoms, the_signs, menstruation, exercise, relief, the_day, small_amounts, sex__symptoms_severity, frequent_urination, night, time, person, women, a_persistent, interstitial_cystitis, sexual_activity, interstitial_cystitis_signs, stress, a_chronic_urinary_tract_infection, your_pelvis, symptom-free_periods, some_people, anus, urinating_pain, you, the_bladder_fills, those, your_symptoms, response, urgent_need, i, a_urinary_tract_infection, men_chronic_pelvic_pain, the_scrotum, patient, everyone, discomfort, a_long_time","Infectious Disease Specialist, Urologist"
interstitial lung disease,"system:'you, patients, a_doctor, proper_treatment, symptoms, shortness, breathing_problems, the_time, your_lungs, the_first_sign, the_primary_signs, it, irreversible_lung_damage, exertion_dry_cough, rest, many_conditions, i, interstitial_lung_disease, breath, your_doctor, patient, an_early_and_accurate_diagnosis",Pulmonologist
intertrigo,"groin, itching_or_burning_sensation, skin, skin_folds, armpits",Dermatologist
intestinal ischemia,"months, 1_to_3_hours_abdominal_pain, that, signs, moderate_or_severe_an_urgent_need, system:'you, patients, pain, symptoms, chronic_intestinal_ischemia, unintended_weight_loss_diarrhea_nausea, fear, mental_confusion, a_bowel_movement, gradually_developing_(chronic)_intestinal_ischemia_signs, vomiting, acute_intestinal_ischemia, older_adults__symptoms, your_stool_nausea, sudden_(acute)_intestinal_ischemia_signs, abdominal_tenderness, abdominal_cramps, suddenly_(acute, one_person, patterns, sudden_belly_(abdominal)_pain, i, weeks, patient, 30_minutes, intestinal_ischemia","Emergency Medicine Physician, Gastroenterologist"
intestinal malabsorption,"minerals, chronic_diarrhea, nutrient_deficiencies, weight_loss, failure, abdominal_pain, vitamins, fatigue",General Practitioner
intestinal obstruction,"crampy_abdominal_pain, a_bowel_movement, that, signs, loss, system:'you, i, gas_swelling, patients, symptoms, intestinal_obstruction, patient, inability, the_abdomen, appetite_constipation",Gastroenterologist
intracranial abscess,"headache, neurological_deficits, fever",Infectious Disease Specialist
intracranial hematoma,"movement, progressive_loss, that, signs, the_body, system:'you, pressure, patients, this_period, symptoms, other_signs, your_brain_increases, more_blood, headache, consciousness_dizziness_confusion_unequal_pupil_size, the_head_injury, time, the_opposite_side, the_lucid_interval, lethargy_seizures, all, you, worse_vomiting_drowsiness, an_intracranial_hematoma, the_narrow_space, paralysis, i, a_head_injury, weeks, the_following_signs, speech_loss, your_brain, patient, skull, some, they",Neurologist
intracranial hemorrhage,"severe_headache, seizures, loss, nausea, vision, consciousness, changes",General Practitioner
intussusception,"medical_attention, that, weakness, system:'you, the_disorder, some_children, patients, pain, nausea, people, children, symptoms, an_otherwise_healthy_infant, its_appearance, the_belly, diarrhea, the_symptoms, adults, their_knees, blood, no_obvious_pain, the_most_common_symptom, time, vomiting, loud_crying, intussusception, other_disorders, the_first_sign, all, belly_pain, their_chests, it, energy, these_painful_episodes, infants, other_symptoms, usually_every_15_to_20_minutes, who, no_other_symptoms, not_everyone, adults_intussusception, i, mucus, a_lump, some_infants, weeks, lack, patient, some_older_children, they, the_pain","Otolaryngologist, Psychiatrist"
invasive lobular carcinoma,"fullness, invasive_lobular_carcinoma, system:'you, patients, its_earliest_stages, thickening, no_signs, symptoms, a_new_area, the_skin, part, other_forms, the_breast, it, appearance, a_newly_inverted_nipple__invasive_lobular_carcinoma, an_area, breast_cancer, a_firm_or_distinct_breast_lump, i, patient, the_texture",Oncologist
iritis,"that, signs, system:'you, patients, symptoms, iritis, eye_redness_discomfort, chronic_iritis, it, up_to_three_months, acute_iritis, days, i, the_affected_eye_sensitivity, one_or_both_eyes, light_decreased_vision__iritis, achiness, three_months, patient, hours",Emergency Medicine Physician
iron deficiency anemia,"fast_heartbeat, dirt, the_body, system:'you, extreme_fatigue_weakness_pale_skin_chest_pain, patients, children, symptoms, the_signs, ice, feet, dizziness, your_tongue_brittle, shortness, unusual_cravings, non-nutritive_substances, iron, iron_deficiency_anemia_signs, lightheadedness_cold_hands, it, soreness, starch, infants, iron_deficiency_anemia, breath_headache, i, poor_appetite, anemia, patient, inflammation","Dermatologist, Pulmonologist"
irritable bowel syndrome,"the_stool, function(playerid, a_gentle_rhythm, that, ""readycallback, system:'you, patients, people, muscles, symptoms, var_kdp, most_people, ibs_results, ""flashvars"":{""iframecustomplugincss1"":""/-/media/kcms/ux, the_most_common_include, a_bowel_movement_changes, those_spasms, ""cache_st"":20200805, (function, player.css, diarrhea, a_bowel_movement, the_food, food, how_irritable_bowel_syndrome, bowel_movement_changes, ibs, you_______video, you__ibs, video, ""autoplay"":false, ""localizationcode"":""auto, a_functional_disorder, the_intestines, 'doplaycallback');_window.inlinereadycallbackcalled_=_playerid;_}});_______})();________show_transcript, video_video, the_movement, some_people, increased_gas, ""entry_id"":""1_gx18hy28, the_rectum, it, gas, you, the_digestive_tract, spasm, appearance, a_fairly_predictable_schedule, =_document.getelementbyid(playerid, the_stomach, other_symptoms, incomplete_evacuation, another_cause, sensation, /css, small_bubbles, your_heightened_sensitivity, the_muscles, the_contractions, i, mucus, /kaltura, patient, oversensitive_nerve_endings, discomfort, they, a_long_time",Gastroenterologist
ischemia of the bowel,"bloody_stools, nausea, low_blood_pressure, rapid_heart_rate, severe_abdominal_pain, diarrhea, fever",Gastroenterologist
ischemic colitis,"they, severe_complications, a_higher_risk, surgery, system:'you, patients, pain, a_feeling, people, symptoms, times, your_bowels_diarrhea_nausea, blood, urgency, kidney_disease, left-sided_colitis, time, your_stool, which, ischemic_colitis, the_risk, passage, you, cramping, right-sided_colitis, tenderness, your_belly, i, the_right_side, patient, this, death, atrial_fibrillation, more_underlying_medical_problems, high_blood_pressure","Gastroenterologist, Urologist"
itchy skin,"spots, system:'you, scaly_patches, patients, itchy_skin, the_skin, small_areas, the_area, this_itch-scratch_cycle, any_other_noticeable_changes, an_arm, a_leg, blisters, it, skin_scratch_marks_bumps, you, the_whole_body, skin_leathery, the_scalp, i, patient, a_long_time",Dermatologist
jaundice,"system:'you, my_stomach, urine, patients, a_high_fever, nausea, my_body, something, terrible_itching, stomach_pain, stomach_pains, diarrhea, some_abdominal_pain, stomach_ache, itching, my_fever, no_energy, a_temperature, my_urine, abdominal_pain, intense_itching, weight, high_fever, a_lot, my_pee, dark_urine, a_yellow_rash, the_past_few_days, some_stomach_pain, severe_itching, yellow_skin, i, patient, my_skin, and_fatigue, a_fever, fatigue","Dermatologist, Gastroenterologist"
jaw tumors cysts,"other_types, the_protective_enamel, fibroma, people, a_long_period, these_cysts, odontogenic_cyst, bone, an_inherited_condition, no_symptoms, central_giant_cell_granuloma, the_most_common_odontogenic_tumor, bone_cells, the_jawbone, large_tumors, dentigerous_cyst, a_tooth, squamous_odontogenic_tumor, tooth_development, the_front_portion, an_abnormal_growth, a_small_or_large_calcified_tumor, i, the_jaws, patient, the_chance, benign_lesions, its_tumorlike_tendency, the_tumor, system:'you, patients, a_tumor, central_giant_cell_granulomas, recurrence, adenomatoid_odontogenic_tumor, the_most_common_form, odontoma, tissue, other_teeth, the_mouth, these, the_third_molars, it, the_cells, others, a_lesion, benign_tumor, the_jaw_and_surrounding_tissue_and_displace_teeth, one_type, cyst, epithelial_odontogenic_tumor, odontogenic_keratocyst, that, pain, tumor_recurrence, odontomas, examples, some_genetic_syndromes, central_odontogenic_fibroma, the_other_type, a_keratocystic_odontogenic_tumor, dental_tissue, these_tumors, a_cyst, eruption, surgical_treatment, the_molars, more-aggressive_forms, the_most_common_type, tumors, nevoid_basal_cell_carcinoma_syndrome, aggressive_surgical_treatment, the_chances, symptoms, cementoblastoma, odontogenic_myxoma, the_teeth, time, aneurysmal_bone_cyst, cysts, odontogenic_myxomas, this_cyst, teeth, part, the_jaw, treatment, an_oddly_shaped_tooth, the_lower_jaw, jaw_tumors, liquid_or_semisolid_material, wisdom_teeth, this_benign_tumor, this_tumor, glandular_odontogenic_cyst, a_tendency, the_cyst, this, osteoblastoma, usually_noncancerous_(benign)_tumor, mass, they",Oncologist
jellyfish stings,"that, the_stings, system:'you, tracks, patients, nausea, children, symptoms, the_skin, the_jellyfish, stomach_pain, spasms, dizziness, the_skin_itchiness, a_reaction, the_stingers, a_leg, headache_muscle_pain, throbbing_pain, severe_jellyfish_stings, multiple_body_systems, these_reactions, size, health, a_""print, confusion_difficulty, the_person, pruritus, severe_reactions, the_tentacles'_contact, an_arm__severe_jellyfish_stings, i, heart_problems, the_age, jellyfish_stings, the_severity, pain_welts, patient, the_type","Dermatologist, Gastroenterologist"
jet lag,"only_one_symptom, system:'you, mood_changes, a_day, patients, symptoms, diarrhea, daytime_fatigue, a_general_feeling, constipation, your_usual_level, jet_lag_symptoms, stomach_problems, each_time_zone, sleep_problems, it, you, jet_lag, i, patient, this, about_a_day, at_least_two_time_zones","Gastroenterologist, Psychiatrist"
jock itch,"skin, the_upper_thigh, the_crease, it, system:'you, i, a_line, patients, the_groin, the_rash, patient, the_skin, a_reddened_area, jock_itch, small_blisters, a_half-moon_shape",Dermatologist
juvenile idiopathic arthritis,"a_nap, larger_joints, joint_pain, arthritis, system:'you, some_cases, the_main_ones, patients, pain, symptoms, swollen_lymph_nodes, naps, times, the_trunk, she, the_morning, a_rash, which, joints, other_forms, the_knee, especially_first_thing, juvenile_idiopathic_arthritis, the_number, you, prominent_features, joint_swelling, he, several_different_subtypes, the_most_common_signs, rashes, i, your_child, high_fever, clumsier, patient, the_evenings, a_fever, fever",Orthopedist
juvenile rheumatoid arthritis,"motion, joint_pain, fever, limited_range",Orthopedist
kawasaki disease,"that, the_onset, the_body, system:'you, the_palms, patients, the_same_time, a_high_fever, children, symptoms, the_soles, other_signs, kawasaki_disease, lips, toes, the_symptoms, 102.2_f, your_child's_health_care_provider, a_rash, these_symptoms, risk, symptom, incomplete_kawasaki_disease, swollen_tongue, the_genital_area, multisystem_inflammatory_syndrome, extremely_red_eyes, which, treatment, it, 10_days, the_hands, the_main_part, a_diagnosis, coronary_artery_injury, a_child, what, the_above_signs, covid-19, skin, who, an_enlarged_lymph_node, i, five_or_more_days, the_feet, the_following_signs, patient, red_skin, a_fever, a_sign, the_neck, fingers","Cardiologist, Dermatologist"
keloid scar,"months, signs, firm_and_rubbery_reddish, system:'you, the_earlobes, patients, symptoms, the_inciting_injury, the_size, middle_chest, your_skin_color_itchiness_discomfort, skin_varied_size, years, shoulders, cheeks, a_keloid_scar, irregular_scarring, the_keloid, varied_texture, i, the_original_injury, hairless, patient","Dermatologist, Otolaryngologist"
keratitis,"eye_redness_eye_pain_excess_tears, vision_sensitivity, other_discharge, system:'you, i, your_eye, patients, keratitis, a_feeling, light, symptoms, photophobia, your_eyelid, patient, something, pain_or_irritation_blurred_vision, your_eye_difficulty",Otolaryngologist
keratoconus,"eyeglass_prescriptions, the_disease, problems, signs, bright_light, frequent_changes, system:'you, i, night, patients, sensitivity, symptoms, patient, which, keratoconus, vision, a_need, they",General Practitioner
keratosis pilaris,"painless_tiny_bumps, low_humidity, system:'you, patients, goose_flesh, symptoms, rough_skin, any_age, the_areas, keratosis_pilaris, young_children, it, dry_skin_sandpaper-like_bumps, thighs, the_upper_arms, seasonal_changes, i, bumps, patient",Dermatologist
kidney cancer,"side, blood, its_early_stages, that, signs, loss, system:'you, i, kidney_cancer, patients, time, red_or_cola_colored_pain, symptoms, your_back, patient, which, your_urine, appetite_unexplained_weight_loss_tiredness_fever","Nephrologist, Oncologist"
kidney cysts,"the_back_or_side_fever, system:'you, i, dull_pain, patients, simple_kidney_cysts, symptoms, a_simple_kidney_cyst, patient, upper_stomach_pain","Nephrologist, Urologist"
kidney failure,"signs, urine_output, system:'you, nausea, patients, no_signs, symptoms, normal_fluid_retention, seizures, irregular_heartbeat_chest_pain, feet, ankles, shortness, your_legs, breath_fatigue_confusion_nausea_weakness, fluid_retention, severe_cases, acute_kidney_failure, pressure_seizures, chest_pain, lab_tests, confusion, sometimes_acute_kidney_failure, another_reason, i, breath, patient, coma, fatigue","Emergency Medicine Physician, Nephrologist"
kidney infection,"side, pain_nausea, blood, the_urine_urine, that, cloudy_belly_pain, system:'you, i, a_kidney_infection, patients, a_burning_feeling, pain, pus, symptoms, patient, lasting_urge, fever","Infectious Disease Specialist, Nephrologist"
kidney stone,"blood, the_urine, frequent_urination, severe_pain, the_side","Nephrologist, Urologist"
kidney stones,"kidney_stones, kidney_stones_________kidney_stones, an_infection, that, signs, system:'you, the_thin_tubes, urine, patients, nausea, fluctuates, instance, a_different_location, symptoms, other_signs, the_kidney, the_ribs_pain, stones, blood, chills, the_tubes, these_symptoms, the_kidneys, which, your_urine, a_kidney_stone, urinating_more_often_than_usual_or_urinating_in_small_amounts_nausea, kidney_stones_form, that_point, it, the_ureter, the_ureters, your_ureters, you, your_bladder, groin_pain, the_stone, bladder, present__pain, severe_pain, intensity, the_side, the_lower_abdomen, burning_sensation, red_or_brown_urine_cloudy_or_foul-smelling_urine, your_kidneys, intensity_pain, sharp_pain, i, your_urinary_tract, the_flow, kidney_stones____________kidney_stones___kidney_stones_kidney_stones_form, patient, waves, close__close_kidney_stones___kidney_stones, fever","Nephrologist, Urologist"
kleptomania,"greater_or_lesser_intensity, they, personal_gain, that, the_course, system:'you, patients, people, no_value, kleptomania_symptoms, most_people, kleptomania, terrible_guilt, relief, fear, the_urge, arousal, items, stores, the_kleptomania_cycle, friends, them, episodes, powerful_urges, time, some, which, arrest, the_stolen_items, increased_tension, a_party, the_theft_return, help, satisfaction, acquaintances, it, public_places, you, the_urges, characteristics, revenge, these_features, kleptomania_steal, the_person, the_place, anxiety, shame, another_person, remorse, most_shoplifters, i, rebellion, patient, inability, a_repetition, family, the_theft_feeling_pleasure, a_dare","Otolaryngologist, Psychiatrist"
klinefelter syndrome,"that, problems, signs, math__men_signs, the_disorder, system:'you, patients, reading, testicles, symptoms, facial_and_body_hair, babies_signs, breast_tissue, the_condition, many_boys, weak_muscles, motor_development, other_men, spelling, thoughts, adulthood, average_height_weak_bones, less_facial_and_body_hair, other_boys, few_or_only_mild_signs, males, firm_testicles_small_penis, average_stature, legs, gynecomastia, feelings, klinefelter_syndrome, a_noticeable_effect, it, teenagers_signs, broader_hips, less_muscle, others, appearance, no_sperm_small_testicles, delay, delayed_or_incomplete_puberty, puberty, boys, crawl, i, birth, growth, age, shorter_torso, low_sperm_count, the_scrotum, patient, other_teens, penis, shy_and_sensitive_difficulty","Orthopedist, Otolaryngologist"
klippel trenaunay,"cataracts, the_immune_system, pelvis, malformed_veins, that, system:'you, the_following_features, people, patients, soft_tissue, lymphatic_system_malformations, the_top_layer, the_surface, infancy, the_skin, lymphatic_fluid, toes, the_trunk, disease, the_arms, more_extensive:_kts__port-wine_stain, bone, hip_dislocation, tissue, the_lymphatic_system, kts, an_arm, fluid_leakage, part, which, these, legs, vein_malformations, bones, other_conditions, a_larger_and_longer_extremity, varicose_veins, it, fusion, extra_lymphatic_vessels, swollen, deeper_malformed_veins, reddish-purple_birthmark, face, overgrowth, the_legs, this_overgrowth, infection, the_birthmark, abdomen, skin, spongy_tissue, who, one_leg, fingers, any_portion, small_veins, i, extra_fingers, age, birth, glaucoma, patient, this, twisted_veins, capillaries, the_tissues, extra_tiny_blood_vessels","Dermatologist, Infectious Disease Specialist"
knee bursitis,"jobs, that, your_kneecap, system:'you, pressure, patients, pain, a_doctor, symptoms, knee_bursitis_result, a_sharp_blow, time, the_affected_portion, irritation, which, the_knee, a_lot, knee_bursitis_signs, it, your_knee, you, the_bursa, kneeling, hard_surfaces, rest, what, addition, most_cases, friction, i, tender, your_doctor, bursa, patient, the_inflammation, a_fever",Infectious Disease Specialist
knee pain,"knee_pain, noises, that, severity, signs, system:'you, i, patients, redness, symptoms, patient, the_location, the_problem, the_touch_weakness, the_cause, the_knee, instability, warmth",General Practitioner
kyphosis,"mild_kyphosis, fact, a_little_kyphosis, who, no_noticeable_signs, system:'you, i, patients, people, pain, symptoms, patient, excessive_curvature",General Practitioner
labyrinthitis,"loss, nausea, ear_pain, dizziness",Otolaryngologist
