Disease,Symptoms,Medical_Specialty
dehydration,"no_wet_diapers, tongue, that, top, system:'you, a_reliable_early_indicator, patients, a_doctor, symptoms, particularly_older_adults, the_signs, bloody_or_black_stool, diarrhea, listlessness, dehydration, infant_or_young_child__dry_mouth, hot_weather, many_people, three_hours, cheeks, the_body's_need, it, soft_spot, you, fluids, eyes, thirst, your_family_doctor, i, no_tears, water, age, patient, skull, irritability__adult__extreme_thirst_less_frequent_urination_dark-colored_urine_fatigue_dizziness_confusion, water_intake, 24_hours, they",Otolaryngologist
delayed ejaculation,"these_categories, that, distress, men, system:'you, patients, generalized_delayed_ejaculation, the_following_types, symptoms, situational, your_partner, the_problem, a_partner, lifelong, certain_sex_partners, delayed_ejaculation, other_men, stimulation, a_period, ejaculate, certain_circumstances, sexual_activity, sexual_stimulation, the_most_effective_treatment, the_time, the_delay, loss, you, sexual_intercourse, an_orgasm, some_men, a_diagnosis, situational_delayed_ejaculation, difficulty, an_underlying_cause, at_all_(anejaculation, what, no_specific_time, i, a_request, sexual_maturity, certain_kinds, erection, other_sexual_activities, patient, lifelong_delayed_ejaculation, 30_minutes, normal_sexual_functioning, physical_irritation, orgasm, frustration, fatigue",General Practitioner
delirium,"brain_cells, a_person, a_hospital, people, interest_and_emotion_quick_changes, their_memory_and_thinking_skills, the_day, a_few_days, behavior, damage, a_switched_night-day_sleep-wake_cycle__types, night, no_symptoms, the_most_common_cause, hyperactive_delirium, trouble, a_short_temper, other_sounds, reduced_awareness, delirium_and_dementia_delirium, things, the_results, surroundings, i, the_room, dementia, patient, a_delirium_episode, an_idea, movement, months, questions, system:'you, rapid_mood_swings, patients, speech, speech_trouble, periods, the_symptoms, episodes, a_constant_level, three_types, years, the_ability, which, these, mood_personality_changes, alzheimer's_disease, it, poor_memory, distrust, others, anger, who, a_topic, the_easiest_type, this_type, minor_symptoms, they, focus, that, attention, elated_lack, better_and_worse_times, sleep_habits, the_early_stages, other_thinking_skills, hypoactive_delirium, delirium_symptoms, delirium_experts, a_short_time, care, both_types, delirium, little_response, rapid_changes, older_adults, mixed_delirium, onset, family, some_differences, a_sense, the_onset, a_day, a_few_hours, symptoms, fear, a_gradual_decline, sluggish_changes, settings, a_medical_problem, words, a_daze, time, both, recent_events, memory, loss, surroundings__poor_thinking_skills, primary_symptoms, day, the_person, anxiety, the_following, someone, activity, this, little_or_no_activity, tests, emotional_changes","Neurologist, Psychiatrist"
dementia,"complex_tasks_difficulty, system:'you, patients, symptoms, words, dementia_symptoms, depression_anxiety, problem-solving_difficulty, which, disorientation__psychological_changes__personality, cognitive_changes__memory_loss, inappropriate_behavior_paranoia_agitation_hallucinations, coordination_and_motor_functions_confusion, difficulty, planning, someone, i, visual_and_spatial_abilities, common_signs, patient, the_cause",Psychiatrist
dengue,"my_eyes, my_joints, muscles, anything, my_back_hurts, red_spots, a_few_days, dizziness, a_severe_headache, a_constant_urge, night, joints, the_past_3_days, high_fever, a_constant_ache, my_muscles, a_mild_fever, my_head, my_appetite, appetite, my_face, enough_sleep, i, patient, a_fever, a_sharp_pain, system:'you, my_stomach, my_body, patients, a_high_fever, a_headache, my_apetite, headache, a_rash, vomiting, which, the_fever, skin_rash, a_severe_fever, the_affected_muscles, it, my_work, a_mild_headache, armpits, my_arms, the_itching, eyes, rashes, some_places, headaches, and_chills, arms, high_fever, a_result, a_strange_pain, severe_joint_pain, my_whole_body, joint_pain, fatigue, a_pain, that, the_back, pain, back_pain, something, malaise, stomach_pains, my_fever, chills, some_red_spots, body_pain, and_legs, my_back, my_health, legs, red_patches, body, neck, any_physical_activities, my_legs, face, what, muscle_pain, stomach_cramps, any_work, a_skin_rash, joint_pain, medication, pressure, nausea, severe_muscle_pain, small_red_spots, the_muscle_pain, them, extreme_body_pain, my_neck, the_spots, muscle_pain, a_lot, my_eyeballs, no_appetite, a_really_bad_headache, red_spots_over_body, the_past_few_days, some_small_red_spots, mild_fever, a_loss, this, my_skin, me, a_long_time","Dermatologist, Orthopedist"
dengue fever,"other_illnesses, signs, your_blood_vessels, system:'you, some_cases, nausea, patients, a_high_fever, the_flu, pain, no_signs, symptoms, most_people, internal_bleeding, headache_muscle, the_first_day, nose_blood, the_skin, joint_pain_nausea, severe_headache, the_eyes, bone, a_life-threatening_emergency, 104_f, difficult_or_rapid_breathing_fatigue_irritability, stools, your_gums, many_people, even_death, the_warning_signs, which, severe_dengue_fever, your_urine, dengue_hemorrhagic_fever, a_dengue_infection, clot-forming_cells, the_number, you, tendencies, your_fever, organ_failure, an_infected_mosquito._dengue_fever, any, joint_and_muscle_pain, i, a_week, severe_dengue, dengue_shock_syndrome, restlessness, high_fever, the_following_signs, patient, this, your_bloodstream, they, platelets","Infectious Disease Specialist, Orthopedist"
dental caries,"tooth_sensitivity, the_teeth, bad_breath, holes, dark_spots, toothache, visible_pits",Pulmonologist
depersonalization derealization disorder,"your_speech, your_senses, people, other_important_areas, school, air, your_sense, the_size, your_own_memories__derealization_symptoms_symptoms, your_memories, distance, blurry, your_surroundings_distortions, i, depersonalization, cotton_emotional_or_physical_numbness, or_a_heightened_awareness, patient, hours, responses, distant_past_distortions, months, late_teens, the_disorder, system:'you, patients, children, a_time, emotion, these_episodes, movements, feelings, some_people, your_body, a_movie, only_a_feeling, objects__episodes, days, arms, derealization, distress, that, early_adulthood, the_world, depersonalization-derealization_disorder, your_thoughts, perception, work, detachment, legs, persistent_and_recurrent_episodes, the_mid-, a_robot, what, older_adults, weeks, shape, ongoing_feelings, your_life, problems, a_dream, symptoms, your_head, clarity, the_experience, an_outside_observer, time, recent_events, you, your_surroundings, not_reality, yourself, parts, control, a_glass_wall_surroundings, example, they, the_sense","Otolaryngologist, Psychiatrist"
depression,"frequent_or_recurrent_thoughts, even_small_tasks, relationships, people, school, increased_cravings, the_day, adults, social_interaction, weight, alcohol, failures, energy, poor_performance, emptiness_or_hopelessness_angry_outbursts, things, appetite, those, worthlessness, decisions, i, a_normal_part, self-harm, patient, hobbies, suicide_unexplained_physical_problems, sex, frustration, physical_aches, self-blame_trouble, system:'you, patients, children, suicidal_thoughts, teens_common_signs, many_people, these_episodes, older_men, some_people, feelings, it, others, pleasure, poor_attendance, nearly_every_day, anger, headaches, restlessness, younger_children, small_matters_loss, back_pain, gain_anxiety, clinginess, pain_fatigue, suicidal_thinking, irritability, food, older_adults_depression, work, guilt, social_activities, agitation, memory_difficulties, sleep_problems, too_much_tiredness, and_avoidance, older_adults, personality_changes, extra_effort_reduced_appetite, lack, some_differences, misunderstood, your_life, normal_activities, medication, pains, symptoms, noticeable_problems, depression_symptoms, teens, sadness, interest, teenagers, insomnia, recreational_drugs, suicide_attempts, weight_loss, help, home, loss, sports_sleep, aches, multiple_episodes, day, new_things, most_or_all_normal_activities, depression, death, speaking_or_body_movements_feelings, a_medical_condition, they","Otolaryngologist, Psychiatrist"
dermatitis due to sun exposure,"redness, sunburn-like_rash",Dermatologist
dermatitis eczema,"the_sides, itchiness, that, signs, system:'you, patients, the_nose, symptoms, hair_follicles, the_face________________seborrheic_dermatitis, the_face____________seborrheic_dermatitis, the_face___seborrheic_dermatitis, a_rash, the_knees, yellowish, atopic_dermatitis, the_knees____________atopic_dermatitis, the_knees___atopic_dermatitis, swollen_skin, a_very_itchy_rash, the_knees________________atopic_dermatitis, the_eyebrows, color, dry_skin_rash, flaking_skin, a_different_part, other_oil-rich_areas, your_body, dandruff, seborrheic_dermatitis, skin_bumps, each_type, the_face_________seborrheic_dermatitis, the_elbows, somewhat_""oily""_scales, the_knees_________atopic_dermatitis, the_face, front, dermatitis, pruritus, addition, your_skin_color_blisters, the_scalp, i, patient, close__close_atopic_dermatitis, close__close_seborrheic_dermatitis, the_neck",Dermatologist
dermatographia,"they, months, system:'you, patients, dermatographia, symptoms, the_skin, the_condition, the_symptoms, lines, itching, years, welts, you, a_few_minutes, friction, days, itself, i, the_skin_symptoms, patient, 30_minutes, several_hours","Dermatologist, Otolaryngologist"
dermatomyositis,"progressive_muscle_weakness, your_knuckles, system:'you, patients, knees, symptoms, the_signs, upper_arms, the_trunk, dermatomyositis, muscle_weakness, a_violet-colored_or_dusky_red_rash, your_hips, time, shoulders, which, your_face, the_weakness, the_first_sign, your_body, skin_changes, eyelids, both_the_left_and_right_sides, the_rash, chest, neck, thighs, the_muscles, those, the_most_common_signs, i, patient","Dermatologist, Orthopedist"
desmoid tumors,"pain_loss, signs, the_body, system:'you, nausea, patients, symptoms, the_affected_area_cramping, desmoid_tumors, desmoid_tumor_symptoms, the_abdomen, legs, area, the_tumors, function, i, arms, patient, a_mass, they",Oncologist
deviated septum,"some_septal_deformities, that, this_blockage, noisy_breathing, most_septal_displacements, breathing, system:'you, pressure, patients, some_debate, the_nose, symptoms, allergies, the_surface, preference, a_possible_cause, both_nostrils, a_deviated_septum, a_severe_deviated_septum, obstruction, nostrils, night, no_symptoms, the_many_reasons, one_side, the_possible_nasal_causes, which, awareness, the_nose_alternates, some_people, one_nasal_passage, it, the_nostril, your_nasal, you, nosebleeds, a_particular_side, your_nose, the_nose_touch, the_nasal_cycle, your_nasal_septum, i, one-sided_facial_pain, the_following_signs, your_risk, nasal_obstruction, sleep, patient, this, facial_pain, the_tissues","Otolaryngologist, Pulmonologist"
diabetes,"a_feeling, people, my_sense, simple_tasks, any_age, 2_diabetes, feet, the_folds, a_chronic_dry_cough, a_byproduct, bruises, this_tingling_sensation, my_mind, intense_urges, trouble, blurred_and_distorted_vision, weight, your_blood_sugar, my_sight, cuts, presence, my_cuts, my_infections, a_sore_throat, things, throat, the_place, my_eyesight, sense, skin, weight_loss, i, patient, childhood, system:'you, patients, diabetes, children, no_reason, taste, the_symptoms, the_more_common_type, a_dry_cough, a_lot_more_water, even_regular_chores, breathing_problems, lethargy, a_while, some_people, it, slow_healing, any_wounds, polyuria, wounds, muscle, excessive_hunger, blurry_vision, my_hand, teen_years, rashes, thirst, both_my_hands, restlessness, my_heart, gum, obesity, infections, my_mouth, enough_available_insulin, some, even_simple_tasks, smell, tremors, fatigue, my_throat, that, yeast_infections, prediabetes, my_wound, urinary_tract_infections, numbness, a_wound, the_urine, other_mood_changes, irregular_sugar_level, type_1_diabetes, my_feet, a_fog, my_skin's_crevices, this_problem, palpitations, skin_irritations, ketones, 2_diabetes_type, the_breakdown, my_hands, palipatations, the_creases, a_racing_heart, the_crevices, type, mood_swings, muscle_twitching, type_2_diabetes, hands, symptoms, a_cough, times, gestational_diabetes, fat, my_vision, slow-healing_sores, a_lot, a_hard_time, rapid_hearbeat, the_need, vaginal_infections, my_emotions, prediabetes_gestational_diabetes, my_wounds, the_bathroom, my_skin, they, a_long_time","Dermatologist, Endocrinologist"
diabetes insipidus,"signs, system:'you, urine, patients, diabetes, symptoms, the_night, wet_diapers, bed-wetting_trouble, about_19_liters, insipidus, cold_drinks, a_lot, an_average, about_1_to_2_liters, you, pale_urine, fluids, as_much_as_20_quarts, vomiting_constipation, 1_to_2_quarts, i, your_condition, a_healthy_adult, the_following_signs, large_amounts, patient, fever","Endocrinologist, Infectious Disease Specialist"
diabetic coma,"blood_sugar, shakiness_anxiety_tiredness, that, a_diabetic_coma, system:'you, patients, a_feeling, diabetes, symptoms, weakness_sweating_hunger, hypoglycemia_unawareness, blurry_vision_confusion_loss, any_symptoms, shortness, hyperglycemia, the_test_results, lightheadedness_headache_difficulty, a_drop, hypoglycemia, weakness_headache_nausea, a_condition, your_blood_sugar, some_people, especially_those, your_skin_dizziness, you, medical_care, consciousness, who, your_diabetes_treatment, i, thirst_frequent_urination_blurred_vision_tiredness, high_or_low_blood_sugar, patient, high_blood_sugar, low_blood_sugar, your_blood_sugar_level, they, a_long_time","Dermatologist, Endocrinologist"
diabetic hypoglycemia,"tongue, that, rarely__symptoms, signs, perspiration_nightmares, severe_hypoglycemia, system:'you, patients, track, symptoms, the_lips, coordination_difficulty, seizures, numbness, any_symptoms, irritability, routine_tasks_loss, person, anxiety_headache_tingling, severe_signs, hypoglycemia, both, your_blood_sugar, early_warning_signs, speech_blurry, the_inability, some_people, convulsions, it, hunger, an_irregular_or_fast_heartbeat_difficulty, you, diabetic_hypoglycemia, hypoglycemia_worsen, tunnel_vision_inability, nightclothes, confusion, tiredness, muscle_weakness_drowsiness, initial_signs, your_sleep, i, your_blood_sugar_levels, any_noticeable_symptoms, fatigue, patient, death, episode, sheets, unusual_behavior, nighttime_signs","Orthopedist, Otolaryngologist"
diabetic ketoacidosis,"diabetic_ketoacidosis_symptoms, home_blood, system:'you, urine, patients, diabetes, symptoms, stomach_pain, these_symptoms, urine_test_kits, fruity-scented_breath, which, the_first_sign, a_need, diabetic_ketoacidosis, high_blood_sugar_level_high_ketone_levels, i, breath, patient, some, 24_hours","Gastroenterologist, Pulmonologist"
diabetic kidney disease,"appetite, need, loss, nausea, ankles, the_legs, high_blood_pressure, fatigue",Nephrologist
diabetic nephropathy,"hands, signs, system:'you, diabetic_nephropathy, patients, symptoms, the_early_stages, later_stages, feet, persistent_itching_fatigue, ankles, appetite_nausea, shortness, breath_loss, the_urine, any_signs, reduced_need, you, insulin_or_diabetes_medicine_confusion, difficulty, eyes, i, patient, blood_pressure_control_protein","Emergency Medicine Physician, Nephrologist, Oncologist, Urologist"
diabetic neuropathy,"mononeuropathy, fullness, the_buttock, weakness, anything, hips, neuropathy, dizziness, muscle_weakness, damage, night, the_shin_or_foot_weakness, vaginal_dryness, foot_drop, awareness, changes, the_face_numbness, the_thigh, fainting, things, sex_organs, your_symptoms, ulcers, i, torso, patient, the_autonomic_nervous_system, the_front_part, even_a_bedsheet's_weight, signs, arm, system:'you, patients, sharp_pains, diabetes, light, leg, nerves, the_eyes, which_nerves, the_hand, pain_or_temperature_changes, reduced_ability, painful_serious_foot_problems, some_people, it, the_way, distal_symmetric_peripheral_neuropathy, eyes, one_type, arms, gastroparesis, this_type, infections, a_lack, that, diabetic_neuropathy, pain, extreme_sensitivity, the_thighs, four_main_types, numbness, one_side, a_sitting_position_chest, these_areas, considerable_nerve_damage, legs, appetite_difficulty, (focal_neuropathy)_mononeuropathy, digestive_system, sensation, any, thigh_muscles_difficulty, heart_rate, the_type, sexual_response, the_most_common_type, men, the_body, nausea, symptoms, double_vision_paralysis, orthostatic_hypotension)_bladder, women, proximal_neuropathy, buttocks, hip, :__difficulty, thigh, sweating_problems, specific_nerve, blood_pressure, loss, more_than_one_type, you, erectile_dysfunction, the_other_side, the_hands, blood_sugar_levels, bladder, the_nerve, difficulty, the_face, severe_pain, peripheral_neuropathy, and_bone_and_joint_damage__autonomic_neuropathy, the_feet, bowel_problems, the_front, the_abdominal_and_chest_area",Neurologist
diabetic retinopathy,"spots, how_often?spotting_symptoms, your_vision, additional_eye_exams, system:'you, patients, diabetes, symptoms, vision, the_early_stages, your_eye_doctor, dark_strings, the_condition, vision_loss, your_vision_vision_loss, developing_diabetes, dilation, diabetic_macular_edema, a_yearly_eye_exam, you, more_informationscreening, dark_or_empty_areas, your_diabetes, blurred_or_distorted_vision, impaired_color_vision, i, an_eye_doctor_careful_management, the_best_way, the_visual_field, floaters, your_risk, patient, diabetic_retinopathy, your_pregnancy","Endocrinologist, Gynecologist"
diaper rash,"skin, signs, tender_skin, the_diaper_area_sores, system:'you, i, fussiness, patients, buttocks, symptoms, diaper_rash, the_diaper_area, patient, diaper_changes, genitals, thighs",Dermatologist
diarrhea,"the_stool_mucus, the_stool, a_bowel_movement, signs, system:'you, i, watery_stools, patients, pain_bloating_nausea, symptoms, abdominal_cramps, patient, diarrhea, fever_blood","Gastroenterologist, Infectious Disease Specialist"
digeorge syndrome,"poor_muscle_tone, low-set_ears, certain_facial_features, that, problems, signs, severity, certain_conditions, system:'you, behavior_problems, the_hospital, patients, a_doctor, diagnostic_tests, the_disorder, symptoms, nasal-sounding_speech_learning_delays, infancy, other_problems, disorders, oxygen-rich_blood, the_roof, some_combination, annual_checkups, poor_circulation, cleft_palate, illnesses, digeorge_syndrome, an_accurate_and_prompt_diagnosis, other_issues, pediatrician, time, any_signs, some_signs, a_heart, the_mouth, disabilities, regularly_scheduled_well-baby_visits, well-baby_visits, weight_or_gastrointestinal_problems, other_conditions, frequent_infections, the_attention, speech_development, failure, it, an_underdeveloped_chin, (cleft_palate, others, a_gap, 22q11.2_deletion_syndrome, what, a_narrow_groove, early_childhood, delays, development, your_family_doctor, i, heart_murmur_and_bluish_skin, wide-set_eyes, birth, your_child, type, doctors, a_result, a_combination, your_doctor, patient, body_systems, the_defects, other_factors, cyanosis, the_upper_lip, the_palate_delayed_growth_difficulty","Cardiologist, Vascular Surgeon"
dilated cardiomyopathy,"the_disease, signs, system:'you, patients, fatigue_shortness, symptoms, the_early_stages, ankles, fluttering_or_pounding_heartbeat_(palpitations, any_signs, reduced_ability, dyspnea, some_people, edema, the_legs, i, activity, breath, patient","Otolaryngologist, Pulmonologist"
dimorphic hemmorhoids(piles),"system:'you, i, patients, irritation_in_anus, constipation, patient, pain_in_anal_region, pain_during_bowel_movements",Gastroenterologist
diphtheria,"they, carriers, a_person, signs, the_throat, system:'you, poor_hygiene, patients, infected_people, pain, other_bacterial_skin_infections, people, symptoms, crowded_conditions, the_skin, skin_diphtheria, rapid_breathing_nasal_discharge_fever, the_united_states, a_sign, their_illness, diphtheria, some_people, the_infection, it, a_second_type, a_sore_throat, only_a_mild_illness, infection, tropical_climates, diphtheria_signs, the_neck_difficulty, gray_membrane, a_gray_membrane, who, ulcers, diphtheria-causing_bacteria, enlarged_lymph_nodes, i, skin_(cutaneous)_diphtheria, redness, patient, hoarseness_swollen_glands, no_obvious_signs","Infectious Disease Specialist, Pulmonologist"
dislocated shoulder,"intense_pain_inability, the_body, system:'you, dislocated_shoulder_symptoms, weakness, patients, the_shoulder, shoulder_dislocation___shoulder_dislocation, shoulder_dislocation, numbness, the_injury, the_arm, shoulder_dislocation________________shoulder_dislocation_________shoulder_dislocation___shoulder_dislocation, shoulder_dislocation____________shoulder_dislocation___shoulder_dislocation, the_most_common_variety, which, your_shoulder, the_most_frequently_dislocated_joint, close__close_shoulder_dislocation___shoulder_dislocation, it, place, the_joint__shoulder_dislocation, the_shoulder_joint, several_directions, the_muscles, i, a_forward_(anterior)_dislocation, patient, the_neck, the_pain",Orthopedist
dislocation of the ankle,"severe_pain, weight, inability",General Practitioner
dislocation of the elbow,"numbness, the_hand/arm, inability, severe_pain, visible_deformity, the_elbow",General Practitioner
dislocation of the patella,"knee_pain, the_leg, inability",General Practitioner
dissociative disorders,"the_u.s, less_urgent_symptoms, people, emotional_or_professional_stress_mental_health_problems, this_disorder, other_important_areas, chat, behavior, these_symptoms, thoughts, or_confide, a_certain_time, certain_time_periods, the_main_symptom, your_actions, a_suicide_hotline, the_diagnostic_and_statistical_manual, things, self, text, (depersonalization, i, an_episode, depersonalization, your_doctor, patient, ., hours, seven_days, months, personal_history, signs, system:'you, patients, suicidal_thoughts, services, three_major_dissociative_disorders, the_presence, your_local_emergency_number, unreal_(derealization, years, a_unique_name, the_people, the_lifeline, which, some_people, feelings, a_movie, it, a_perception, intense_combat, dissociative_identity_disorder, identity_significant_stress, your_life_inability, the_american_psychiatric_association, two_or_more_people, voice, dsm-5, other_people, derealization, other_identities, that, memory_loss, events, complete_loss, unsafe_behavior, your_relationships, the_world, a_traumatic_time, your_emotions, mental_disorders, depersonalization-derealization_disorder, work, a_dissociative_disorder, detachment, dreamlike, traumatic_flashbacks, each_identity, a_trusted_relative, information, characteristics, the_others, normal_forgetfulness, the_988_suicide_&_crisis_lifeline, dissociative_disorders, obvious_differences, differences, mannerisms, a_distance, amnesia, dissociative_fugue, the_type, your_life, problems, eyeglasses, only_a_few_moments, friend, a_doctor, a_loved_one, symptoms, your_head, time, personal_information, an_emergency_room, both, identities, behaviors, travel, the_need, multiple_personality_disorder, a_crisis, memory, you, dissociative, yourself, depression, an_ongoing_or_episodic_sense, anxiety, dissociative_amnesia, a_blurred_sense, someone, gender, this, a_medical_condition, even_such_physical_qualities","Emergency Medicine Physician, Psychiatrist"
diverticulitis,"the_lower_left_side, asian_descent, system:'you, nausea, patients, pain, people, symptoms, the_signs, diarrhea, diverticulitis, vomiting, constipation, the_abdomen, which, the_usual_site, several_days, abdominal_tenderness, i, the_right_side, patient, fever, the_pain",Infectious Disease Specialist
diverticulosis,"abdominal_pain, bowel_movements, changes",Gastroenterologist
dizziness,"system:'you, heavy-headedness, nausea, people, patients, a_feeling, the_episode, motion, balance, your_head, dizziness, these_feelings, spinning_(vertigo)_lightheadedness, sensations, your_dizziness, it, you, wooziness, a_number, any, faint_unsteadiness, days, a_false_sense, i, a_loss, patient, seconds",General Practitioner
double uterus,"menstruation_or_experience_repeated_miscarriages, that, system:'you, patients, a_doctor, menstrual_bleeding, the_condition, blood, repeated_miscarriages, the_woman, no_symptoms, medical_advice, women, a_regular_pelvic_exam, a_menstrual_flow, the_insertion, these_situations, you, one_vagina, a_double_vagina, severe_pain, a_double_uterus, the_second_uterus, who, i, vagina, patient, the_cause, imaging_tests, a_tampon",Gynecologist
down syndrome,"poor_muscle_tone, system:'you, patients, the_more_common_features, intellectual_and_developmental_problems, children, short_height__infants, each_person, distinct_facial_features, the_eye, small_hands, feet_excessive_flexibility_tiny_white_spots, adults, short_hands, other_children, a_single_crease, not_all_people, moderate_cognitive_impairment, average_size, down_syndrome, some_people, serious_heart_defects, iris, significant_health_problems, brushfield's_spots, others, the_colored_part, language, i, palpebral_fissures, the_palm_relatively_short_fingers, face_small_head_short_neck, both_short_and_long-term_memory, most_children, patient, intellectual_disabilities, some, the_same_features, they, unusually_shaped_or_small_ears","Orthopedist, Otolaryngologist"
dresslers syndrome,"months, surgery, the_chest, system:'you, i, patients, chest_pain_fever, weeks, injury, symptoms, patient, a_heart_attack","Infectious Disease Specialist, Otolaryngologist"
drug abuse (barbiturates),"drowsiness, respiratory_depression, speech, sedation, confusion","Psychiatrist, Pulmonologist"
drug abuse (cocaine),"heart_attack, increased_energy, risk, rapid_heart_rate, pupils, euphoria, high_blood_pressure","Cardiologist, Otolaryngologist"
drug abuse (methamphetamine),"increased_energy, rapid_heartbeat, appetite","Cardiologist, Otolaryngologist"
