Disease,Symptoms,Medical_Specialty
prader willi syndrome,"a_constant_craving, excessive_daytime_sleepiness, prader-willi_syndrome, body_temperature, other_signs, or_both, distinct_facial_features, hypopigmentation, feet, adults, this_results, their_voices, milestones, cryptorchidism, careful_management, changes, hair, sex_organs, nearly_all_cases, skin, routine, i, large_portions, age, the_scrotum, patient, hypotonia, childhood, small_hands, poor_muscle_tone, signs, individuals, system:'you, the_disorder, thinking, patients, a_common_feature, behavior_problems, reduced_saliva_flow, children, the_spine_(scoliosis, speech, infancy, even_those, the_head, stimulation, a_primary_sign, high_body_fat, adulthood, low_muscle_mass, poor_articulation, the_normal_sleep_cycle, which, these, a_turned-down_mouth, some_learning_disabilities, an_ongoing_problem, decreased_muscle_tone, other_mental_health_disorders, these_features, scrotum, issues, hypogonadism, eyes, thyroid_hormone, or_a_lack, birth, infections, sleep, physical_development, pigment, that, underdeveloped_genitals, almond-shaped_eyes, a_baby, babies, incomplete_or_delayed_puberty, much_facial_hair, labia, central_adrenal_insufficiency, sleep_disorders, a_classic_sign, motor_development, food, underdeveloped_sex_organs, disruptions, curvature, a_high_pain_tolerance, rag_dolls, cognitive_impairment, a_condition, ovaries, mild_to_moderate_intellectual_disability, a_small_penis, failure, temper_tantrums, the_testicles, significant_intellectual_disability, behavioral_problems, life, obsessive-compulsive_or_repetitive_behaviors, these_disorders, poor_sucking, underproduction, reasoning, breathing_pauses, even_garbage, other_vision_problems, frozen_food, nearsightedness, physical_movement, men, problems, unusual_food-seeking_behaviors, the_body, a_poor_sucking_reflex, knees, feeding, symptoms, poor_sucking_reflex, infants_signs, speech_problems, times, other_children, hip_problems, words, a_weak_cry, time, the_clitoris, women, toddlers, other_features, the_abdomen, stress, males, treatment, a_narrowing, a_hard_time, infertility, constant_hunger, rapid_weight_gain, (hypothyroidism, little_or_no_sex_hormones, a_thin_upper_lip, growth_hormone, infants, poor_growth, the_temples, early_childhood, other_endocrine_problems, anxiety, generally_poor_responsiveness, short_adult_height, their_30s, females, their_elbows, food_craving_and_weight_gain, example, they","Endocrinologist, Psychiatrist"
precocious puberty,"boys, voice, development, the_following, penis, system:'you, i, patients, age, testicles, symptoms, breast_growth, precocious_puberty_signs, patient, facial_hair, pubic_or_underarm_hair_rapid_growth_acne_adult_body_odor, girls, first_period",Dermatologist
prediabetes,"that, hunger_fatigue_blurred_vision_numbness, the_body, system:'you, patients, prediabetes, symptoms, 2_diabetes, armpits_and_groin._classic_signs, any_signs, affected_areas, frequent_infections_slow-healing_sores, you, certain_parts, unintended_weight_loss, skin, i, one_possible_sign, the_neck, the_feet, patient, thirst_frequent_urination","Dermatologist, Endocrinologist"
preeclampsia,"hands, that, levels, kidney_problems, system:'you, urine, patients, preeclampsia_signs, other_organs, symptoms, other_signs, no_noticeable_symptoms, the_upper_belly, vision, light_sensitivity_shortness, swelling, sudden_weight_gain, fluid, liver_problems, temporary_loss, blood, damage, a_sudden_appearance, the_kidneys, a_sign, your_face, routine_prenatal_visits, the_lungs_pain, the_right_side_nausea, the_defining_feature, you, preeclampsia, edema, visual_disturbances, thrombocytopenia, proteinuria, the_first_signs, headaches, i, severe_headaches, breath, healthy_pregnancies, a_health_care_provider, excess_protein, patient, or_other_signs, the_ribs, weight_gain, liver_enzymes, blurred_vision, high_blood_pressure, platelets","Gastroenterologist, Pulmonologist"
pregnancy loss miscarriage,"your_abdomen, pregnancy, a_miscarriage, signs, system:'you, your_vagina, the_hospital, patients, pain, most_miscarriages, symptoms, the_12th_week, analysis, tissue, most_women, it, you, cramping, the_first_trimester, fetal_tissue, a_clean_container, successful_pregnancies, vaginal_spotting, who, your_health_care_provider's_office, i, patient, lower_back_fluid",Gynecologist
pregnancy-induced hypertension,"pregnancy, high_blood_pressure",Cardiologist
pregnancy-related back pain,"the_pelvic_area, lower_back_pain, discomfort",Gynecologist
prehypertension,"blood_pressure, device, it, home, system:'you, i, you, patients, the_only_way, regular_blood_pressure_checks, your_health_care_provider, symptoms, patient, your_blood_pressure",Cardiologist
premature birth,"a_head, girls____weight, (22_cm)____gestational_age_weight__length_head_circumference__gestational_age_weight__length_head_circumference, 3.4_kg, 24_weeks, an_intermediate_care_nursery, extra_help, each_sex, 6.9_oz, a_full-term_baby's_features, premature_babies, 7_lbs, 3.3_oz, gestational_age, (31.5_cm, night, fine_hair, 15_oz, premature_birth, 1.7_kg, a_preterm_baby, 3.6_kg, (29_cm, a_team, (2.4_kg, i, 28_weeks, the_median_birth_weight, patient, ., low_body_temperature, 7.9_oz, questions, system:'you, patients, a_special_nursery_unit, the_delivery_room, gestational_age_weight__length_head_circumference, 32_weeks, features, (35_cm, their_health_day, (25_cm)__24_weeks, 35_weeks, head_circumference, which, 6.8_oz, your_health_care_team, 5.2_oz, 12_oz, (29.5_cm, 40_weeks, (21_cm)______weight, different_gestational_ages, girls___gestational_age_weight_length_head_circumference, birth, 15.5_oz, your_baby's_care_plan, (22_cm)____weight, a_lack, small_size, that, special_nursery_units, girls_____gestational_age_weight_length_head_circumference, (1.0_kg, the_hospital, the_nicu, (26_cm, your_baby, (21_cm)____gestational_age_weight_length_head_circumference__gestational_age_weight_length_head_circumference, 0.65_kg, length, 1.8_kg, (25_cm)__28_weeks, a_neonatal_intensive_care_unit, the_following_tables, 2_lbs, (31_cm, cells, 5_lbs, 4.7_oz, what, delivery, boys, feeding_problems, (32_cm, very_mild_symptoms, (25_cm, nicu, (36.5_cm, the_body, trouble_breathing, (22_cm)______weight, girls__weight, them, (21_cm, (21_cm)_special_care, 2.5_kg, more-serious_health_problems, 1.1_kg, time, health_care_providers, some_signs, a_unit, 2.4_kg, 3_lbs, a_step, (0.60_kg, (36_cm, you, preterm_babies, (22_cm, less_intensive_care, (1.1_kg, some_infants, (42_cm, 1.0_kg, this","Gastroenterologist, Pulmonologist"
premature ejaculation,"all_sexual_situations, problems, system:'you, lifelong_premature_ejaculation, patients, previous_sexual_experiences, symptoms, times, the_symptoms, premature_ejaculation, many_people, early_ejaculation, ejaculation, the_main_symptom, it, a_diagnosis, more_than_three_minutes, masturbation, the_first_sexual_encounter, penetration, i, the_criteria, patient, they",Otolaryngologist
premature ovarian failure,"they, the_change, an_increased_risk, pregnancy, signs, system:'you, your_health_care_provider, patients, symptoms, periods, bone_loss, exercise_habits, years, your_period, a_pregnancy, which, vaginal_dryness_dry_eyes_irritability, stress, your_provider, irregular_or_skipped_periods, diet, it, pregnant_hot_flashes_night, you, heart_disease, difficulty, low_estrogen_levels, what, a_number, birth_control_pills_difficulty, or_a_change, those, i, reasons, primary_ovarian_insufficiency, a_health_care_provider, menopause_or_estrogen_deficiency, three_months, patient, the_cause, decreased_sexual_desire","Gynecologist, Orthopedist"
premature ventricular contractions,"missed_beats, the_chest, system:'you, i, the_extra_beats, patients, the_heartbeat, premature_ventricular_contractions, unusual_sensations, patient, few_or_no_symptoms, awareness, skipped_beats","Cardiologist, Otolaryngologist"
premature ventricular contractions (pvcs),"palpitations, skipped_or_extra_heartbeats","Cardiologist, Otolaryngologist"
premenstrual syndrome,"social_withdrawal_poor_concentration_change, system:'you, food_cravings_trouble, patients, a_small_number, fluid_retention_abdominal_bloating_breast_tenderness_acne_flare-ups_constipation, symptoms, symptom_severity, the_signs, the_list, libido__physical_signs, premenstrual_dysphoric_disorder, irritability, the_start, most_women, premenstrual_syndrome, these_problems, depressed_mood_crying, their_daily_lives, the_physical_pain, the_menstrual_period, women, pms_pmdd_signs, tension, emotional_and_behavioral_signs, symptoms__joint_or_muscle_pain_headache_fatigue_weight_gain, appetite_changes, diarrhea_alcohol_intolerance, difficulty, emotional_stress, anger, pms, depression, this_form, anxiety, pmdd, i, symptoms__tension, mood_swings, patient, potential_signs, four_days, some","Orthopedist, Psychiatrist"
premenstrual tension syndrome,"mood_swings, breast_tenderness, irritability","Gynecologist, Psychiatrist"
presbycusis,"speech, high-pitched_sounds, gradual_hearing_loss, difficulty",Otolaryngologist
presbyopia,"the_letters, normal_reading_distance_eyestrain, presbyopia, an_area, system:'you, i, you, patients, these_signs, age, headaches, close-up_work, symptoms, these_symptoms, dim_lighting, patient, reading_material, a_tendency",General Practitioner
prescription drug abuse,"prescription_drug_abuse, their_mind-altering_properties, signs, more_than_one_prescriber, (adderall, system:'you, patients, pain, symptoms, percocet, pain_relief, sedatives, concerta, sedatives__drowsiness_confusion, opioids, valium, medicines, high_irregular_heartbeat_high_blood_pressure_high_body_temperature_reduced_appetite_insomnia_agitation_anxiety_paranoia__other_signs, diazepam, dexedrine, attention-deficit/hyperactivity_disorder, ritalin, higher_doses__anti-anxiety_medicines, speech_poor_concentration_dizziness_problems, prescriptions, so_more_prescriptions, oxycodone, zolpidem_(ambien)_stimulants, higher_doses, hypnotics, mydayis, memory, xanax, certain_sleep_disorders, methylphenidate, others, (norco, the_most_misused_prescription_drugs, slowed_breathing__stimulants, anxiety_and_sleep_disorders, high_slowed_breathing_rate_drowsiness_confusion_poor_coordination_increased_dose, those, adhd, poor_decisions, i, early_refills, mood_swings, patient, alprazolam, prescription_drug_abuse_opioids__constipation_nausea, drowsy, oxycontin, the_specific_drug, dextroamphetamine-amphetamine","Psychiatrist, Pulmonologist"
preterm labor,"signs, membranes, system:'you, pelvic_or_lower_abdominal_pressure, patients, symptoms, vaginal_spotting_or_light_bleeding_preterm_rupture, the_baby_breaks, regular_or_frequent_sensations, a_gush, a_change, abdominal_tightening, mild_abdominal_cramps, vaginal_discharge, a_sensation, contractions, i, the_membrane, a_continuous_trickle, type, preterm_labor, patient, fluid",General Practitioner
priapism,"not_fully_rigid_penile_shaft, soft_progressively_worsening_penile_pain__stuttering_priapism, signs, system:'you, some_cases, patients, short_duration, symptoms, some_blood_flow, sexual_interest, childhood, the_erectile_tissue, more-frequent_and_more-prolonged_erections, the_condition, the_more_common_type, high-flow_priapism, low-flow_priapism, blood, prolonged_erections, the_blood_vessels, episodes, stimulation_erect, enough_oxygen, unwanted_and_painful_erections, the_contraction, time, stimulation_rigid_penile_shaft, glans, more_than_four_hours, sickle_cell_disease, trauma, nonischemic_priapism, males, painful_erection, ischemic_priapism_ischemic_priapism, smooth_muscles, it, the_penis, a_problem, the_penile_tissue, recurrent_or_intermittent_priapism, a_form, abnormally_shaped_red_blood_cells, immediate_medical_care, the_tip, oxygen, complications, the_veins, priapism, the_penile_tissues, repetitive_episodes, the_result, who, the_arteries, ischemic_priapism, priapism_symptoms, i, nonischemic_priapism_nonischemic_priapism, erection, sickle_cells, an_uncommon_condition, patient, the_two_main_types, penis, stuttering_priapism, an_inherited_disorder, the_type","Orthopedist, Psychiatrist"
primary biliary cholangitis,"the_disease, hypothyroidism, poorer_outcomes, that, (splenomegaly, system:'you, the_upper_right_abdomen, the_palms, patients, liver_failure, yellowing, weak_and_brittle_bones, greasy_stools, symptoms, steatorrhea, the_skin, osteoporosis, buildup, sun_exposure, ankles, the_eyes, blood_tests, elbows, hyperpigmentation, other_reasons, dry_eyes, fatty_deposits, routine_testing, the_abdomen, which, underactive_thyroid, diagnosis, ascites, common_early_symptoms, primary_biliary_cholangitis, eyelids, edema, (jaundice, xanthomas, muscle, swollen_feet, )_weight_loss, the_next_5_to_20_years, high_cholesterol_diarrhea, more_than_half_the_people, those, fatigue_itchy_skin__later_signs, who, soles, eyes, the_creases, i, mouth_pain, any_noticeable_symptoms, patient, joint_(musculoskeletal)_pain, fluid","Dermatologist, Orthopedist"
primary cough headaches,"the_ears, secondary_cough_headaches, other_types, the_back, and_not_a_cough_headache, system:'you, patients, pain, a_headache, people, symptoms, your_head, their_headaches, longer_lasting_headaches, loss_blurred_vision, up_to_two_hours_cause, cough_headaches, splitting, only_a_cough_headache, a_cough_headache, double_vision_tremor, other_headache_pain, ""_pain, you, a_few_minutes, fainting_ringing, i, a_headache_condition, migraine, patient, this, hours, some, example, they, both_sides","Neurologist, Otolaryngologist"
primary immunodeficiency,"a_typical_immune_system, that, a_person, signs, skin_infections, arthritis, system:'you, patients, sinus_infections, lupus, symptoms, the_infections, a_healthy_immune_system, bronchitis, ear_infections, nausea_and_diarrhea_delayed_growth_and_development_autoimmune_disorders, person, opportunistic_infections, primary_immunodeficiency_disorder, inflammation, loss, you, cramping, internal_organs_blood_disorders, infection, appetite, frequent_and_recurrent_pneumonia, primary_immunodeficiency, the_most_common_signs, low_platelet_count_or_anemia_digestive_problems, someone, i, type, infections, patient, they, meningitis, the_type","Otolaryngologist, Pulmonologist"
primary insomnia,"irritability, daytime_sleepiness, difficulty",General Practitioner
primary lateral sclerosis,"hands, the_disease, tongue, problems, signs, weakness, system:'you, patients, bladder_problems, symptoms, speech, your_arms, primary_lateral_sclerosis, movement_tripping, your_legs, years, person, highly_variable_effects, rapid_and_intense_shifts, emotions, jaw, your_tongue, difficulty, the_legs, balance_hand_clumsiness_hoarseness, spasticity, one_leg, your_spinal_cord, i, difficulties, muscle_spasms, patient, clumsiness, mood_lability","Neurologist, Orthopedist"
primary progressive aphasia,"the_disease, other_neurological_symptoms, the_brain, phrases, people, other_problems, the_brain's_language_areas, grammar, poor_judgment, temporal_or_parietal_lobes, brain_activity, words_difficulty, disabilities, affected_areas, a_problem, mayo_clinic_staff, mayo_clinic, risk_factors_risk_factors, function, blunted_emotions, i, sentences, patient, which_portion, substantial_difficulty, movement, the_disorder, system:'you, patients, speech, inappropriate_social_behavior, the_presence, errors, three_types, the_ability, certain_sections, word_meanings, which, a_shrinking_(atrophy, some_people, certain_gene_mutations, it, other_members, behavioral_or_social_problems, this_case, particularly_developmental_dyslexia, word_substitutions, the_condition, atrophy, objects__logopenic_variant_primary_progressive_aphasia_signs, apraxia, lobes, a_childhood_learning_disability, primary_progressive_aphasia, semantic_variant_primary_progressive_aphasia_signs, particularly_single_words_trouble, complications, language, their_ability, speech_sounds, rare_gene_mutations, problems, different_symptoms, the_affected_person, symptoms, other_mental_skills, words, mayo_clinic_staff__primary_progressive_aphasia_care, poor_grammar, these_complications, somewhat_higher_risk, your_family, help, nonfluent-agrammatic_variant_primary_progressive_aphasia_signs, you, memory, difficulty, day, the_left_side, depression, primary_progressive_aphasia_symptoms, form_trouble, abnormal_proteins, complex_sentences","Neurologist, Psychiatrist"
primary sclerosing cholangitis,"the_disease, that, signs, jaundice, yellow_eyes, system:'you, patients, symptoms, an_x, several_years, -, no_reliable_way, a_routine_blood_test, primary_sclerosing_cholangitis, enlarged_liver_enlarged_spleen_weight_loss, the_disease_progresses, an_unrelated_condition, skin, early_signs, i, liver_abnormalities, patient, ray, they","Dermatologist, Gastroenterologist"
proctitis,"proctitis_signs, your_abdomen, fullness, system:'you, i, you, patients, a_feeling, bowel_movements, symptoms, your_rectum_rectal_pain_pain, patient, the_left_side, a_frequent_or_continuous_feeling, a_bowel_movement_rectal_bleeding_passing_mucus, your_rectum_diarrhea_pain",Gastroenterologist
progeria,"a_distinctive_appearance, signs, below-average_height, system:'you, eyebrows, patients, thin_lips, symptoms, stiff_joints_hip_dislocation_insulin_resistance, the_skin, the_eyelids_hair_loss, progeria, intelligence, the_trunk, motor_development, scleroderma, delayed_and_abnormal_tooth_formation, the_first_year, fat, blood_vessel_(cardiovascular)_disease, weight, fragile_bones, visible_veins_high-pitched_voice__signs, some_hearing_loss_loss, prominent_eyes, loss, severe_progressive_heart, extremities, life, tightening, the_face, face, health_issues, a_child, this_progressive_disorder, incomplete_closure, skin, eyelashes, beaked_nose_head, i, growth, muscle_mass_skeletal_abnormalities, patient","Cardiologist, Orthopedist"
progressive supranuclear palsy,"the_disease, a_surprised_or_frightened_facial_expression, system:'you, an_inability, patients, symptoms, balance, additional_signs, the_characteristic_signs, or_experience, speech_problems, problem-solving_and_decision-making_depression, progressive_supranuclear_palsy, the_eyes, food, time, interest, awkward_movements, parkinson's_disease, which, rigid_facial_muscles_dizziness, no_reason_difficulties, some_people, loss, impulsive_behavior, you, a_tendency, this_difficulty, those, conversation, i, dementia, a_loss, your_eyes, double_vision, sensitivity, reasoning, patient, pleasurable_activities, poor_eye_contact, they, the_neck","Neurologist, Orthopedist"
prolactinoma,"the_breasts, that, signs, tumors, system:'you, surrounding_tissues, the_pituitary_gland__females, patients, a_prolactinoma, symptoms, vaginal_dryness_acne, the_signs, both_females, headache, painful_intercourse, a_large_tumor, your_blood, any_signs, tumor_growth, interest, excessive_body, hyperprolactinemia, milky_discharge, males, vision_problems, infertility, facial_hair_growth, erectile_dysfunction, no_menstrual_periods, loss, sexual_activity__pressure, size, breasts, irregular_menstrual_periods, prolactinoma, hypogonadism, the_reproductive_system, who, missed_or_irregular_menstrual_periods, i, vision_problems_headache_reduction, females, patient, other_hormones, this, some","Endocrinologist, Gynecologist"
prostate cancer,"urinating_decreased_force, the_stream, its_early_stages, that, signs, erectile_dysfunction, system:'you, i, patients, the_semen_bone_pain_losing_weight, no_signs, symptoms, prostate_cancer, trouble, patient, urine_blood, the_urine_blood",Oncologist
prostatitis,"groin, the_penis_or_testicles_painful_ejaculation_fever, signs, system:'you, patients, pain, symptoms, cloudy_urine_blood, the_area, lower_back_pain, chills, disorder, night, (nocturia, the_abdomen, acute_bacterial_prostatitis, rectum_(perineum)_pain, muscle_aches, burning_sensation, i, the_urine_pain, other_flu-like_symptoms, prostatitis, the_scrotum, patient, discomfort, dribbling_or_hesitant_urination_frequent_urination, they, the_type","Infectious Disease Specialist, Orthopedist"
protein deficiency,"the_limbs, weakness, delayed_wound_healing, hair_loss, impaired_immunity, muscle, fatigue",Orthopedist
pseudobulbar affect,"that, situations, system:'you, patients, people, a_doctor, laughter, involuntary_and_uncontrollable_outbursts, pseudobulbar, your_mood, the_condition, crying, sleep_disturbances, episodes, pba, duration, any_time, several_minutes, sadness, these_emotional_responses, helpful_specialists, which, awareness, the_emotional_response, your_emotional_state, neuropsychologists, a_change, tears, it, you, psychiatrists, a_mildly_amusing_comment, others, pba_episodes, many_cases, a_more_common_sign, neurologists, appetite, depression, the_degree, response, certain_features, those, who, i, a_loss, a_persistent_feeling, your_doctor, a_neurological_condition, patient, the_primary_sign, example, a_lack","Neurologist, Psychiatrist"
pseudocholinesterase deficiency,"that, signs, system:'you, the_muscle_relaxant_succinylcholine, patients, people, no_signs, most_people, symptoms, this_disorder, the_condition, this_medication, that_time, time, muscle_paralysis, part, muscle_relaxation, pseudocholinesterase_deficiency, you, the_length, anesthesia, i, patient","Orthopedist, Psychiatrist"
pseudogout,"it, system:'you, i, the_knees, patients, a_pseudogout_attack, patient, the_affected_joints, the_wrists, ankles",Orthopedist
pseudohypoparathyroidism,"low_calcium_levels, rounded_face, short_stature, hypocalcemia, tetany, (muscle_spasms","Endocrinologist, Orthopedist"
pseudomembranous colitis,"the_stool, system:'you, pus, nausea, patients, pain, symptoms, watery_diarrhea, several_months, dehydration, you, pseudomembranous_colitis, tenderness, stomach_cramps, i, mucus, patient, the_antibiotic, fever","Gastroenterologist, Infectious Disease Specialist"
pseudotumor cerebri,"pseudotumor_cerebri_signs, months, that, system:'you, blindness, patients, symptoms, your_head, years, the_side_double_vision, a_whooshing_sound, shoulder_or_back_pain, a_few_seconds, often_severe_headaches, your_heartbeat_nausea, i, your_eyes, patient, vomiting_or_dizziness_vision_loss_brief_episodes, one_or_both_eyes_difficulty",Oncologist
