Disease,Symptoms,Medical_Specialty
(vertigo) paroymsal  positional vertigo,"headache, system:'you, i, nausea, patients, loss_of_balance, spinning_movements, patient",General Practitioner
abdominal aortic aneurysm,"an_enlarging_abdominal_aortic_aneurysm, system:'you, abdominal_aortic_aneurysms, patients, a_pulse, back_pain, the_belly, them, time, side, you, others, some_aneurysms, abdomen, the_belly_area, noticeable_symptoms, i, patient, the_bellybutton, constant_pain",Cardiologist
abdominal hernia,"discomfort, pain, visible_bulge",General Practitioner
abdominal injury,"blood, urine, bowel_movements, nausea, abdominal_pain, difficulty, tenderness, changes",Gastroenterologist
abscess,"redness, pus_formation, pain, fever",Infectious Disease Specialist
abscess of nose,"redness, the_nose, discharge, pain",Infectious Disease Specialist
abscess of the lung,"shortness, pus, breath, cough, phlegm, chest_pain, fever, fatigue","Infectious Disease Specialist, Pulmonologist"
acanthosis nigricans,"groin, the_affected_skin, creases, it, an_odor, system:'you, i, velvety_skin, patients, the_armpits, acanthosis_nigricans, skin_tags, patient, body_folds, the_main_sign, the_neck",Dermatologist
achalasia,"drink, that, signs, system:'you, patients, symptoms, night_pneumonia, your_throat, food, time, which, dysphagia, difficulty, chest_pain, food_or_saliva_heartburn, achalasia_symptoms, aspiration, the_lungs, i, patient, inability","Otolaryngologist, Pulmonologist"
achilles tendinitis,"that, the_back, sprinting, system:'you, your_heel_bone, close__close_achilles, patients, calf_muscles, achilles_tendinitis, the_achilles, tendon, mild_activity, other_sports_activity, the_pain, an_overuse_injury, episodes, the_morning, tissue, the_heel, tendinitis_achilles, the_lower_leg, which, tendinitis, stair_climbing, you, the_band, the_leg, uh-kill-eez, tenderness, prolonged_running, i, a_mild_ache, patient, more-severe_pain, achilles",Orthopedist
achilles tendon rupture,"your_heel, system:'you, an_inability, patients, a_popping_or_snapping_sound, no_signs, symptoms, an_achilles_tendon_rupture, most_people, the_toes, the_feeling, the_injury, a_pop, medical_advice, the_heel, the_foot, it, you, i, the_calf_pain, your_doctor, patient, the_injured_leg",Orthopedist
acinic cell carcinoma,"facial_changes, lump",Oncologist
acl injury,"signs, system:'you, patients, a_feeling, symptoms, motion, range, an_acl_injury, acl, the_knee_severe_pain, a_loud_pop, a_""popping""_sensation, activity_rapid_swelling_loss, way, i, weight_bearing, patient, inability, instability",Otolaryngologist
acne,"pimples, system:'you, pus, patients, hair_follicles, the_skin, cystic_acne, cystic_acne____________cystic_acne___cystic_acne_cystic_acne, boil-like_inflammation, nodules, cystic_acne_cystic_acne, small_red, painful_lumps, acne_signs, acne, their_tips, shoulders, which, skin_rash, cystic_lesions, pus_filled_pimples, your_skin, cystic_acne___cystic_acne_cystic_acne, pus-filled_lumps, pores, pustules, chest, the_most_severe_form, oil_and_dead_skin_cells, tender_bumps, the_face, whiteheads, papules, upper_back, cystic_acne________________cystic_acne_________cystic_acne___cystic_acne_cystic_acne, i, your_condition, the_resulting_rupture, the_severity, patient, forehead, close__close_cystic_acne___cystic_acne_cystic_acne",Dermatologist
acoustic neuroma,"months, the_tumor, signs, problems, weakness, system:'you, many_years, pressure, patients, vertigo)_facial_numbness, serious_consequences, the_hearing_and_balance_nerves, acoustic_neuroma, symptoms, unsteadiness, muscle_movement, more_noticeable_or_severe_signs, tinnitus, total_hearing_loss, years, rare_cases, trouble, nearby_blood_vessels, facial_and_trigeminal_nerves, the_brainstem, the_tumor's_effects, it, loss, only_one_side, you, balance_dizziness, sensation, the_affected_ear, facial_muscles, your_balance, one_ear, i, your_ear, early_diagnosis, an_acoustic_neuroma, your_doctor, brain_structures, common_signs, patient, nearby_nerves, they","Neurologist, Oncologist"
acromegaly,"facial_features, hands, dysfunction, that, system:'you, patients, people, an_enlarged_nose, symptoms, the_upper_airway_vision_problems_headaches, lips, newer_ones, old_photos, feet, limited_joint_mobility, a_common_sign, your_shoe_size, the_facial_bones, obstruction, years, persistent_or_severe_menstrual_cycle_irregularities, women, interest, your_face's_shape, which, men_loss, enlarged_vocal_cords, skin_excessive_sweating_and_body_odor_small_outgrowths, skin_tags)_fatigue, another, severe_snoring, you, gradual_changes, acromegaly_signs, joint_or_muscle_weakness_pain, skin_tissue, husky_voice, rings, a_protruding_lower_jaw_and_brow_bone, nose, any, one_person, early_signs, i, the_physical_changes, tongue_coarse, acromegaly, your_teeth, patient, thickened_lips, example, sex","Orthopedist, Otolaryngologist"
actinic keratosis,"hands, system:'you, some_cases, patients, the_top_layer, symptoms, red_or_brown_itching, the_skin, patch, the_head, dry_or_scaly_patch, actinic_keratoses, surface_color_variations, wartlike, new_patches, forearms, 2.5_centimeters, sun-exposed_areas, appearance, neck, scaly, skin, i, bumps, less_than_1_inch, patient, diameter","Dermatologist, Otolaryngologist"
acute bronchospasm,"shortness, chest_tightness, breath","Emergency Medicine Physician, Pulmonologist"
acute coronary syndrome,"acute_coronary_syndrome, signs, system:'you, pressure, patients, pain, diabetes, symptoms, the_signs, your_age, dizziness, the_shoulders, upper_abdomen, the_most_common_symptom, dyspnea, the_chest, other_medical_conditions, you, unusual_or_unexplained_fatigue, older_adult, chest_pain, diaphoresis, sex, i, discomfort, breath, arms, patient, indigestion_shortness, a_woman, they, angina","Cardiologist, Emergency Medicine Physician"
acute flaccid myelitis,"sudden_arm_or_leg_weakness, weakness_difficulty, system:'you, patients, symptoms, muscle_tone, numbness, reflexes, the_eyes, the_arms, eyelids_facial_droop, back__uncommon_symptoms, life-threatening_body_temperature_changes, legs, sudden_loss, it, neck, speech_pain, difficulty, the_muscles, the_most_common_signs, acute_flaccid_myelitis, i, urine__severe_symptoms, respiratory_failure, patient, inability, other_possible_signs, blood_pressure_instability",Emergency Medicine Physician
acute glaucoma,"severe_eye_pain, blurred_vision, lights, halos",Emergency Medicine Physician
acute kidney injury,"fluid_retention, urine_output, fatigue","Emergency Medicine Physician, Nephrologist"
acute liver failure,"ascites, your_skin, signs, system:'you, i, patients, acute_liver_failure, yellowing, disorientation_or_confusion_sleepiness_breath, symptoms, a_general_sense, patient, eyeballs, a_musty_or_sweet_odor_tremors, your_upper_right_abdomen, jaundice)_pain","Emergency Medicine Physician, Gastroenterologist"
acute lymphocytic leukemia,"abdomen, the_gums_bone_pain_fever_frequent_infections, a_general_decrease, signs, system:'you, i, energy, patients, groin_pale_skin_shortness, symptoms, swollen_lymph_nodes, breath_weakness, patient, frequent_or_severe_nosebleeds_lumps, armpits, acute_lymphocytic_leukemia, the_neck, fatigue","Emergency Medicine Physician, Oncologist"
acute myelogenous leukemia,"acute_myelogenous_leukemia, breath_pale_skin_frequent_infections, those, the_gums, signs, other_common_diseases, system:'you, i, patients, general_signs, the_flu, fatigue_shortness, bruising_unusual_bleeding, symptoms, frequent_nosebleeds, patient, fever_bone_pain_lethargy, the_early_stages","Emergency Medicine Physician, Oncologist"
acute otitis media,"fluid_drainage, muffled_hearing, the_affected_ear, loss, the_ear, ear_pain, fever",Emergency Medicine Physician
acute pancreatitis,"severe_upper_abdominal_pain, jaundice, nausea, swollen_and_tender_abdomen, rapid_pulse, fever","Emergency Medicine Physician, Gastroenterologist"
acute sinusitis,"(runny_nose, your_nose_pain, that, the_throat, the_back, system:'you, pressure, some_cases, patients, cough, the_nose, symptoms, other_signs, headache, altered_sense, pressure_headache, acute_sinusitis_signs, nasal_congestion, postnasal_drainage, cheeks, post-nasal_drip, congestion, difficulty, tenderness, nose, thick_nasal_discharge, i, yellow_or_greenish_mucus, your_eyes, forehead, your_teeth, patient, facial_pain, smell_cough_bad_breath_fatigue_fever, fever, fatigue","Emergency Medicine Physician, Otolaryngologist, Pulmonologist"
addisons disease,"then_a_stress, months, the_disease, life-threatening_shock, system:'you, patients, people, salt, symptoms, sexual_issues, diarrhea, the_symptoms, abdominal_pain_muscle, addison's_disease, vomiting, dehydration_reduced_consciousness_or_delirium_low_blood_pressure, adrenal_failure, darkened_skin_low_blood_pressure, the_lower_back, severe_weakness_confusion_pain, legs, some_people, addison's_disease_symptoms, it, loss, addisonian_crisis, appetite_areas, joint_pain_irritability_depression_body_hair_loss, hypoglycemia_nausea, who, acute_adrenal_failure, i, injury, severe_abdominal_pain, patient, low_blood_sugar, extreme_fatigue_weight_loss, emergency_treatment, illness","Emergency Medicine Physician, Orthopedist"
adenoid cystic carcinoma,"facial_numbness, lump",Oncologist
adenomyosis,"system:'you, adenomyosis, pressure, patients, no_signs, symptoms, menstruation, pelvic_pain, only_mild_discomfort, severe_cramping, you, tenderness, dyspareunia, your_uterus, i, dysmenorrhea, chronic_pelvic_pain_painful_intercourse, patient, your_lower_abdomen",Gynecologist
adhd,"some_daily_activities, older_children, school, the_seat, feet, inattentive_symptoms, typical_developmental_behavior, tasks, a_higher_activity_level, trouble, the_primary_features, impulsivity, energy, his, others'_conversations, the_level, hyperactive_and_impulsive_symptoms, one_activity, pencils, hyperactivity, close_attention, a_mix, games, i, the_majority, whose_schoolwork, age, patient, a_pattern, situations, instructions, system:'you, lose_items, one_time, patients, the_questioner, children, adhd_adhd_adhd_adhd, his_or_her_turn, adhd_children, friends, an_activity, adulthood, young_children, it, activities, adhd_symptoms, others, inattention, schoolwork, their_friends, who, toys, answers, that, some_children, the_go, something, short_attention_spans, three_subtypes, friendships, another, a_child, focused_mental_effort, the_classroom, addition, boys, adhd, careless_mistakes, preschoolers, hyperactive/impulsive_symptoms, inattention_and_hyperactive-impulsive_behavior, her_hands, siblings, most_healthy_children, homework, problems, symptoms, school_assignments, other_situations, interest, attention_span, males, teenagers, behaviors, their_parents, home, details, difficulty, girls, chores, constant_motion, chores__hyperactivity, females, this, example, they",Psychiatrist
adjustment disorders,"your_life, friend, signs, the_u.s, system:'you, overwhelmed_difficulty, patients, adjustment_disorder, a_doctor, symptoms, behavior__symptoms, some_examples, suicidal_thoughts, chat, services, more_stress, persistent_or_chronic_adjustment_disorders, the_world, behavior, them, adjustment_disorders, significant_problems, daily_activities, social_supports, your_local_emergency_number, time, thoughts, person, stressful_events, an_emergency_room, a_stressful_event, trouble, or_confide, the_lifeline, concerns, treatment, more_than_6_months, your_actions, your_child's_adjustment, a_trusted_relative, a_suicide_hotline, the_end, appetite_difficulty, important_things, unemployment, an_adjustment_disorder, you, stressors, the_stressor, a_new_stressful_situation, the_stress, the_stressful_event, life, things, the_988_suicide_&_crisis_lifeline, yourself, text, we, response, a_part, bills_suicidal_thoughts, someone, i, each_day, your_doctor, lack, your_child's_pediatrician, three_months, patient, ., the_same_emotional_struggles, seven_days, the_type","Emergency Medicine Physician, Psychiatrist"
adrenal cancer,"irregular_periods_hormone_changes, that, men, signs, causes, an_adrenal_gland_cell, system:'you, the_body, these_inherited_syndromes, patients, people, a_tumor, hair_loss, symptoms, healthy_cells, something, the_skin_hormone_changes, a_cell's_dna, a_cell, the_head, inherited_syndromes, certain_cancers, the_abnormal_cells, mutations, women, the_mutations, hormonal_imbalances, testicles_nausea, the_instructions, weight, the_cell, appetite_loss, the_risk, pink_or_purple_stretch_marks, changes, the_tumor_cells, it, mayo_clinic_staff, abdominal_or_back_pain, adrenal_cancer, risk_factors, the_dna, weight_gain_muscle_weakness, what, adrenal_cancer_forms, other_parts, mayo_clinic, beckwith-wiedemann_syndrome_carney_complex_li-fraumeni_syndrome_lynch_syndrome_multiple_endocrine_neoplasia, unexplained_weight_loss, i, pain_fever_loss, type, enlarged_breast_tissue, patient, excess_facial_hair, this, mayo_clinic_staff__adrenal_cancer_care","Nephrologist, Oncologist"
adult adhd,"low_frustration_tolerance, your_life, that, problems, ongoing_problems, adhd__impulsiveness_disorganization, system:'you, outbursts, attention, patients, symptoms, a_task_trouble, fewer_symptoms, your_difficulties, anxiety_or_mood_disorders, adults, major_symptoms, adhd_adhd_adhd_diagnosis, these_persistent_and_disruptive_symptoms, tasks, many_adults, stress, some_adults, poor_time_management, certain_adhd_symptoms, almost_everyone, other_conditions, adhd_adhd_many_adults, some_people, meetings, the_main_features, everyday_tasks, it, typical_behavior, traffic, you, adhd_adhd_adult_adhd_symptoms, excessive_activity, the_past, difficulty, social_plans, anger, hot_temper_trouble, what, more_than_one_area, a_challenge, their_lives, daily_functioning, adhd, some_point, early_childhood, those, line, depression, anxiety, impulses, some_symptoms, i, impatience, restlessness, mood_swings, missed_deadlines, patient, at_least_one_other_mental_health_condition, they, the_inability","Otolaryngologist, Psychiatrist"
adult congenital heart disease,"signs, system:'you, patients, irregular_heart_rhythms, symptoms, adults, congenital_heart_disease, adulthood, a_congenital_heart_defect, some_people, lips_and_fingernails_(cyanosis)_shortness, edema, organs, arrhythmias)_blue_skin, i, body_tissue, breath, patient, common_congenital_heart_disease_symptoms",Cardiologist
adult stills disease,"hands, system:'you, patients, lupus, this_disorder, most_people, symptoms, sore_throat, your_trunk, the_signs, wrists, ankles, lymphoma, the_joint_discomfort, your_neck, muscular_pain, a_type, achy_and_swollen_joints, still's_disease, especially_your_knees, the_first_symptoms, shoulders, cancer, the_fever, adult, your_daily_activities, at_least_two_weeks, legs, other_conditions, the_late_afternoon, you, a_daily_fever, the_rash, the_lymph_nodes, your_joints, muscle_pain, early_evening, those, your_temperature, two_fever_spikes, i, a_combination, a_week, arms, the_following_signs, rash, patient, this, a_salmon-pink_rash, at_least_102_f, fever, the_pain","Orthopedist, Otolaryngologist"
age spots,"they, hands, that, the_back, system:'you, patients, people, children, can_group, the_skin, a_speckled_or_mottled_appearance, increased_pigmentation, the_most_sun_exposure, repeated_sun_exposure, adults, feet, close__close_age_spots, them, all_skin_types, the_hand, light_skin, freckles, shoulders, the_years, which, the_backs, (13_millimeters, the_hand_age_spots, oval_areas, no_sun_exposure, the_hand____________age_spots, freckle_size, tops, size, upper_back_range, areas, skin, fade, about_1/2_inch, i, patient, the_hand___age_spots, the_hand_________age_spots, age_spots, the_hand________________age_spots, group","Dermatologist, Otolaryngologist"
agoraphobia,"your_life, that, problems, major_distress, system:'you, pressure, patients, train, a_feeling, malls, typical_agoraphobia_symptoms, a_peak, symptoms, agoraphobia, parking_lots, fear, avoidance, diarrhea, anxiety_disorder, dizziness, sudden_flushing, small_stores, other_areas, extreme_fear, chills, open_spaces, another_panic_attack, a_panic_attack, a_type, stomach, the_actual_danger, other_disabling_or_embarrassing_symptoms, the_situation, work, a_variety, intense_physical_symptoms, bridges, some_people, these_situations, help, plane, panic_disorder, it, similar_situations, you, proportion, an_attempt, a_few_minutes, rapid_heart_rate, enclosed_spaces, a_heart_attack, chest_pain, a_companion, social_situations, panic_attacks, the_place, addition, anxiety, future_panic_attacks, line, a_sudden_feeling, i, your_fear, control, a_loss, public_transportation, the_fear, six_months, a_bus, patient, elevators, crowds, movie_theaters","Gastroenterologist, Psychiatrist"
aids,"patches_in_throat, system:'you, i, patients, patient, extra_marital_contacts, high_fever","Infectious Disease Specialist, Otolaryngologist"
airplane ear,"airplane_ear, fullness, system:'you, patients, pain, symptoms, your_ear_feeling, spinning_sensation, tinnitus, moderate_hearing_loss, stuffiness, moderate_discomfort, you, severe_pain, severe_hearing_loss, i, your_ear, common_signs, patient, one_or_both_ears",Otolaryngologist
albinism,"people, len-tij-ih-neez, the_retina, the_brain, sunburn, color, slight_changes, hair, strabismus, a_key_feature, things, the_optic_nerve, an_object, skin, bright_light, eye_color, i, astigmatism, head_posture, age, patient, melanin_production, childhood, the_thin_layer, albinism, system:'you, eyebrows, very_light-colored_eyes, patients, light, brown, the_curve, vision, the_head, the_eyes, the_teen_years, pigmentation, african_or_asian_descent, hair_color, the_sun, the_environment, very_light-colored_skin, tissue, which, some_people, three_dimensions, others, minerals, who, eyes, skin_color, water, the_inside_back_wall, that, the_lens, large_freckle-like_spots, an_uncommon_head_position, extreme_sensitivity, early_adulthood, the_eye, solar_lentigines, all_types, no_ability, very_light_blue, moles, eye_movements, hair_hair_color, the_same_direction, legal_blindness, a_condition, african_descent, parents, enough_pigment, eye_color_eyelashes, some_lighting, contact, the_irises, nerve_signals, poor_depth_perception, differences, back-and-forth_movement, vision_vision_problems, the_front_surface, photophobia, siblings, blurred_vision, a_difference, exposure, problems, the_same_time, symptoms, the_easiest_form, reduced_vision, the_colored_parts, results, freckles, other_blood_relatives, the_usual_nerve_pathways, objects, white_hair, eye_problems, this_difference, the_development, complete_blindness, this, they","Dermatologist, Neurologist"
alcohol intolerance,"an_alcoholic_beverage, a_reaction, signs, alcohol_intolerance, pre-existing_asthma, system:'you, i, patients, ingredients, facial_redness, symptoms, hives, runny_or_stuffy_nose_low_blood_pressure_nausea, patient, itchy_skin_bumps, diarrhea","Dermatologist, Pulmonologist"
alcohol intoxication,"speech, impaired_coordination, confusion",General Practitioner
alcohol poisoning,"a_person, the_gag_reflex, the_consequences, system:'you, a_doctor, patients, (unconsciousness, symptoms, medical_help, seizures, his_or_her_head, caution, (hypothermia, the_classic_signs, she, your_local_emergency_number, all_the_above_signs, time, an_emergency, her, alcohol_poisoning, risk, irregular_breathing, pale_skin_low_body_temperature, alcohol, information, breaths, his_or_her_own_vomit, help, it, the_way, blue-tinged_skin, you, hospital_or_emergency_personnel, loss, the_right_help, a_gap, more_than_10_seconds, immediate_medical_care, your_friend, the_person, what, consciousness, yourself, confusion, he, the_side, him, who, someone, slow_breathing, i, the_kind, less_than_eight_breaths, alcohol_poisoning_signs, an_unconscious_person, medical_intervention, patient, this, amount","Dermatologist, Pulmonologist"
alcohol use disorder,"negative_consequences, 355_milliliters, 8_to_9_ounces, school, these_symptoms__alcohol_use_disorder, poor_judgment, a_strong_craving, alcohol, 148_milliliters, alcoholism, inappropriate_behavior, health_issues, i, hard_liquor, distilled_spirits, your_ability, alcohol_consumption, patient, hobbies, coma, repeated_alcohol_use, situations, signs, system:'you, behavior_problems, patients, speech, periods, alcohol_use, 1.5_ounces, about_7%_alcohol, these, the_number, sweating, it, the_national_institute, about_5%_alcohol, restlessness, very_high_blood_alcohol_levels, tremors, 12_ounces, events, attention, hallucinations, about_40%_alcohol, a_tolerance, alcohol_withdrawal, alcohol_intoxication, unsuccessful_attempts, cravings, swimming, 237_to_266_milliliters, malt_liquor, permanent_brain_damage, work, unstable_moods, agitation, your_bloodstream_increases, alcohol_use_disorder, rapid_heartbeat, regular_beer, alcohol_intoxication_results, major_obligations, what, ""blackouts, continued_use, tolerance, drunk_(alcohol_intoxication, the_amount, and_occasionally_seizures, several_hours, problems, social_and_work_activities, nausea, symptoms, 1_drink, hand_tremors, urge, a_reduced_effect, relationship_problems, time, even_death, about_12%_alcohol, one_standard_drink, and_poor_coordination, a_lot, mental_changes, home, memory, you, withdrawal_symptoms, the_same_amount, social_situations, wine, 5_ounces, the_blood_alcohol_concentration, 44_milliliters, anxiety, withdrawal, alcohol_abuse, its_effect, inability, bad_effects, neglecting_responsibilities","Neurologist, Psychiatrist"
alcoholic hepatitis,"your_abdomen, the_liver_kidney, that, jaundice, system:'you, often_low_grade_fatigue, patients, people, the_appetite, liver_failure, other_signs, symptoms, additional_signs, the_skin, swelling_of_stomach, their_calories, ascites)_confusion, severe_alcoholic_hepatitis, appetite_nausea, the_eyes, alcoholic_hepatitis, alcohol_suppresses, behavior, toxins, fluid_accumulation, history_of_alcohol_consumption, alcohol, a_buildup, yellowish_skin, loss, abdominal_tenderness_fever, distention_of_abdomen, whites, i, heavy_drinkers, the_most_common_sign, weakness__malnutrition, large_amounts, patient","Dermatologist, Gastroenterologist"
allergies,"stuffy_nose_watery, hay_fever, tongue, a_drug_allergy, wheezing_anaphylaxis, stings, some_types, signs, system:'you, patients, eczema, the_nose, itchy_skin, allergies, symptoms, the_lips, breath_skin_rash, itch_redden_flake, a_food_allergy, anaphylaxis, the_substance, shortness, chest_tightness, shock, a_drop, atopic_dermatitis, sinuses, breath_anaphylaxis__a_drug_allergy, which, and_digestive_system, foods, roof, nasal_passages, severe_shortness, blood_pressure, allergy_symptoms, allergic_reactions, a_life-threatening_medical_emergency, the_mouth_runny, loss, red_or_swollen_eyes, you, an_insect_sting_allergy, the_body_cough, weak_pulse_nausea, your_airways, face, consciousness, a_life-threatening_reaction, an_allergic_skin_condition, swelling_(edema, the_sting_site_itching, skin, wheezing, eyes, i, some_severe_cases, conjunctivitis, allergic_rhinitis, hives, patient, sneezing_itching, a_large_area, a_severe_reaction","Dermatologist, Otolaryngologist"
allergy,"my_eyes, chest_pains, my_sense, anything, a_runny_nose_and_itchy_eyes, lips, the_swelling, a_few_days, heat, fevers, my_nose, night, nasal_congestion, trouble, my_muscles, chest, my_head, my_appetite, a_sore_throat, chest_pain, breathing_issues, my_face, i, my_chest_hurts, patient, cramps, my_taste, chest_discomfort, system:'you, my_stomach, my_body, patients, a_headache, difficulty_breathing, the_night, itchy_skin, the_skin, diarrhea, taste, the_area, a_dry_cough, other_body_parts, breathing_problems, a_stiff_neck, which, cheeks, a_hoarse_voice, watery_eyes, it, a_scratchy_throat, all_the_time, a_blocked_nose, queasy, headaches, the_puffiness, my_mouth, smell, my_whole_body, my_throat, that, pain, cough, chills, swollen_skin, a_runny_nose, my_cheeks, asthma, body, muscle_pain, sneezing, stomach_cramps, runny_eyes, shaky, ache, itchy_eyes, flaky_skin, and_a_cough, the_puffing, fever, a_really_bad_sore_throat, nausea, my_lips, eye_inflammation, symptoms, a_cough, times, especially_my_lips, a_lot, my_chest, a_hard_time, a_stuffy_nose, difficulty, muscle_aches, wheezing, a_tickle, breath, my_skin, red_skin, me","Otolaryngologist, Pulmonologist"
alopecia,"hair_loss, patchy_or_generalized_hair_loss",General Practitioner
alpha gal syndrome,"the_system, red_meat, tongue, that, other_food_allergies, peanuts, other_allergens, the_body, system:'you, one_reason, patients, the_time_delay, dairy_products, most_reactions, symptoms, alpha-gal_syndrome, the_lips, stomach_pain, diarrhea, the_symptoms, minutes, them, a_reaction, shortness, blood, stomach, vomiting, a_t-bone_steak, gelatins, foods, lamb, beef, the_alpha-gal_molecules, the_reason, it, you, reactions, an_allergic_reaction, meat_products, researchers, the_delayed_reaction, throat, common_food, those, products, wheezing, dinner, or_other_body_parts, midnight, i, scaly_skin, pork, breath, hives, patient, an_alpha-gal_allergic_reaction, mammals, a_possible_connection, organ_meats, example, they","Otolaryngologist, Pulmonologist"
